sentence_good,sentence_bad,linguistic_phenomenon,paradigm,item_id,critical_word,cue_word
De reisleider wees de toeristen een pittoresk restaurant aan voor de lunch.,De reisleider beschuldigde de toeristen een pittoresk restaurant aan voor de lunch.,Argument Structure,argument_number_ditransitive,1313,een pittoresk restaurant,wees
De vrienden gaven de bruid en bruidegom een origineel huwelijkscadeau.,De vrienden beschuldigden de bruid en bruidegom een origineel huwelijkscadeau.,Argument Structure,argument_number_ditransitive,1314,een origineel huwelijkscadeau,gaven
De vader leende zijn zoon een gereedschapskist voor het klusproject.,De vader analyseerde zijn zoon een gereedschapskist voor het klusproject.,Argument Structure,argument_number_ditransitive,1315,een gereedschapskist,leende
De lerares vertelde de studenten een interessant verhaal tijdens de les.,De lerares instrueerde de studenten een interessant verhaal tijdens de les.,Argument Structure,argument_number_ditransitive,1316,een interessant verhaal,vertelde
Lisa bood haar vriend een luisterend oor tijdens zijn moeilijke periode.,Lisa beoordeelde haar vriend een luisterend oor tijdens zijn moeilijke periode.,Argument Structure,argument_number_ditransitive,1317,een luisterend oor,bood
De professor toonde de studenten de resultaten van het experiment op het bord.,De professor bewees de studenten de resultaten van het experiment op het bord.,Argument Structure,argument_number_ditransitive,1318,de resultaten,toonde
De manager wees de verschillende teamleden de projecten toe op basis van hun vaardigheden.,De manager organiseerde de verschillende teamleden de projecten toe op basis van hun vaardigheden.,Argument Structure,argument_number_ditransitive,1319,de projecten,wees
De grootmoeder vertelde haar kleinkinderen een spannend verhaal voor het slapengaan.,De grootmoeder interpreteerde haar kleinkinderen een spannend verhaal voor het slapengaan.,Argument Structure,argument_number_ditransitive,1320,een spannend verhaal,vertelde
Het radiostation zond luisteraars de hitlijsten over de hele wereld.,Het radiostation programmeerde luisteraars de hitlijsten over de hele wereld.,Argument Structure,argument_number_ditransitive,1321,de hitlijsten,zond
De organisator gunde deelnemers extra tijd om hun projecten af te ronden.,De organisator benijdde deelnemers extra tijd om hun projecten af te ronden.,Argument Structure,argument_number_ditransitive,1322,extra tijd,gunde
Sam leerde zijn studenten een complex wiskundig concept tijdens de les.,Sam verkondigde zijn studenten een complex wiskundig concept tijdens de les.,Argument Structure,argument_number_ditransitive,1323,een complex wiskundig concept,leerde
De directeur overhandigde de werknemer een certificaat voor zijn uitstekende prestaties.,De directeur deelde de werknemer een certificaat voor zijn uitstekende prestaties.,Argument Structure,argument_number_ditransitive,1324,een certificaat,overhandigde
De consultant adviseerde het bedrijf een nieuwe strategie voor marktuitbreiding.,De consultant deelde het bedrijf een nieuwe strategie voor marktuitbreiding.,Argument Structure,argument_number_ditransitive,1325,een nieuwe strategie,adviseerde
Kim schotelde haar gasten pasta voor afgelopen vrijdag.,Kim onthulde haar gasten pasta voor afgelopen vrijdag.,Argument Structure,argument_number_ditransitive,1326,pasta,schotelde
De auteur schreef zijn fans een persoonlijke boodschap in elk boek tijdens het signeren.,De auteur componeerde zijn fans een persoonlijke boodschap in elk boek tijdens het signeren.,Argument Structure,argument_number_ditransitive,1327,een persoonlijke boodschap,schreef
De secretaresse mailde de klanten de agenda voor de komende vergadering.,De secretaresse schreef de klanten de agenda voor de komende vergadering.,Argument Structure,argument_number_ditransitive,1328,de agenda,mailde
Het bedrijf bood de klanten een gratis proefperiode van hun nieuwe software aan.,Het bedrijf redde de klanten een gratis proefperiode van hun nieuwe software aan.,Argument Structure,argument_number_ditransitive,1329,een gratis proefperiode,bood
De wetenschapper verschafte zijn collega's nieuwe gegevens voor hun onderzoek.,De wetenschapper voorzag zijn collega's nieuwe gegevens voor hun onderzoek.,Argument Structure,argument_number_ditransitive,1330,nieuwe gegevens,verschafte
De jury gunde de kunstenaar de eerste prijs voor zijn opmerkelijke schilderij.,De jury instrueerde de kunstenaar de eerste prijs voor zijn opmerkelijke schilderij.,Argument Structure,argument_number_ditransitive,1331,de eerste prijs,gunde
De koning verleende de ridder een koninklijke gunst voor zijn moed in de strijd.,De koning nam de ridder een koninklijke gunst voor zijn moed in de strijd.,Argument Structure,argument_number_ditransitive,1332,een koninklijke gunst,verleende
De journalist onthulde het publiek een schokkend nieuwsfeit.,De journalist camoufleerde het publiek een schokkend nieuwsfeit.,Argument Structure,argument_number_ditransitive,1333,een schokkend nieuwsfeit,onthulde
De ouders gaven hun kinderen levenslessen mee voor hun toekomst.,De ouders dachten hun kinderen levenslessen mee voor hun toekomst.,Argument Structure,argument_number_ditransitive,1334,levenslessen,gaven
De dokter raadde de patiënt een gezondere levensstijl aan voor zijn herstel.,De dokter verloor de patiënt een gezondere levensstijl aan voor zijn herstel.,Argument Structure,argument_number_ditransitive,1335,een gezondere levensstijl,raadde
De bibliotheek leende de leden boeken uit voor hun leesplezier.,De bibliotheek staarde de leden boeken uit voor hun leesplezier.,Argument Structure,argument_number_ditransitive,1336,boeken,leende
De verkoper verkocht de klant een gloednieuwe auto voor zijn familie.,De verkoper maakte de klant een gloednieuwe auto voor zijn familie.,Argument Structure,argument_number_ditransitive,1337,een gloednieuwe auto,verkocht
De oudere broer schoof zijn jongere broertje een koekje toe.,De oudere broer sloeg zijn jongere broertje een koekje toe.,Argument Structure,argument_number_ditransitive,1338,een koekje,broer
De bank maakte de klant een aanzienlijk bedrag op zijn rekening over.,De bank annuleerde de klant een aanzienlijk bedrag op zijn rekening over.,Argument Structure,argument_number_ditransitive,1339,een aanzienlijk bedrag,maakte
De ober reikte de klant de menukaart aan voor het diner.,De ober sorteerde de klant de menukaart aan voor het diner.,Argument Structure,argument_number_ditransitive,1340,de menukaart,reikte
De medewerker leverde de collega's de benodigde documenten aan voor de vergadering.,De medewerker onthield de collega's de benodigde documenten aan voor de vergadering.,Argument Structure,argument_number_ditransitive,1341,de benodigde documenten,leverde
De dirigent droeg het koor een nieuw stuk op voor het concert.,De dirigent labelde het koor een nieuw stuk op voor het concert.,Argument Structure,argument_number_ditransitive,1342,een nieuw stuk,droeg
De koerier gaf de klant een pakketje af voor de deur.,De koerier sloeg de klant een pakketje af voor de deur.,Argument Structure,argument_number_ditransitive,1343,een pakketje,gaf
De mentor gaf zijn leerlingen wijze adviezen mee voor hun carrière.,De mentor misleidde zijn leerlingen wijze adviezen mee voor hun carrière.,Argument Structure,argument_number_ditransitive,1344,wijze adviezen,gaf
De boer voerde de dieren een gezond dieet voor hun welzijn.,De boer negeerde de dieren een gezond dieet voor hun welzijn.,Argument Structure,argument_number_ditransitive,1345,een gezond dieet,voerde
De verkoper smeerde de klant een extra product aan voor meer verkoop.,De verkoper bestudeerde de klant een extra product aan voor meer verkoop.,Argument Structure,argument_number_ditransitive,1346,een extra product,smeerde
De politicus zegde de kiezers een betere toekomst toe tijdens de campagne.,De politicus sloeg de kiezers een betere toekomst toe tijdens de campagne.,Argument Structure,argument_number_ditransitive,1347,een betere toekomst,zegde
De onderzoeker verschafte de studenten nieuwe inzichten voor hun studie.,De onderzoeker ontkende de studenten nieuwe inzichten voor hun studie.,Argument Structure,argument_number_ditransitive,1348,nieuwe inzichten,verschafte
De advocaat fluisterde zijn cliënt een strategie in voor de rechtszaak.,De advocaat stal zijn cliënt een strategie in voor de rechtszaak.,Argument Structure,argument_number_ditransitive,1349,een strategie,fluisterde
De beoordelaar wees de studenten een score toe voor hun prestaties.,De beoordelaar ontdekte de studenten een score toe voor hun prestaties.,Argument Structure,argument_number_ditransitive,1350,een score,wees
De dief biechtte de politie zijn misdrijf op voor een mildere straf.,De dief kende de politie zijn misdrijf op voor een mildere straf.,Argument Structure,argument_number_ditransitive,1351,zijn misdrijf,biechtte
Dora vertrouwde haar beste vriendin haar geheimen toe.,Dora negeerde haar beste vriendin haar geheimen toe.,Argument Structure,argument_number_ditransitive,1352,haar geheimen,vertrouwde
De leraar dicteerde de studenten een woordenlijst voor de spellingles.,De leraar strafte de studenten een woordenlijst voor de spellingles.,Argument Structure,argument_number_ditransitive,1353,een woordenlijst,dicteerde
De ouder hield zijn kinderen een voorbeeld van integriteit voor.,De ouder evalueerde zijn kinderen een voorbeeld van integriteit voor.,Argument Structure,argument_number_ditransitive,1354,een voorbeeld,hield
Emma toonde haar vriendin de nieuwe schilderijen.,Emma ontdekte haar vriendin de nieuwe schilderijen.,Argument Structure,argument_number_ditransitive,1355,de nieuwe schilderijen,toonde
Julia stuurde haar broer een felicitatiekaart.,Julia verstuurde haar broer een felicitatiekaart.,Argument Structure,argument_number_ditransitive,1356,een felicitatiekaart,stuurde
Thijs stelde zijn vrienden een interessante vraag.,Thijs bedacht zijn vrienden een interessante vraag.,Argument Structure,argument_number_ditransitive,1357,een interessante vraag.,stelde
Laura bezorgt haar collega een kopie van het rapport.,Laura beraadt haar collega een kopie van het rapport.,Argument Structure,argument_number_ditransitive,1358,een kopie,bezorgt
De leraar gaf de leerlingen een uitdagende opdracht.,De leraar sloeg de leerlingen een uitdagende opdracht.,Argument Structure,argument_number_ditransitive,1359,een uitdagende opdracht,gaf
Iris overhandigde haar buurman een zelfgebakken taart.,Iris haalde haar buurman een zelfgebakken taart.,Argument Structure,argument_number_ditransitive,1360,een zelfgebakken taart,overhandigde
Simon adviseerde zijn vriendin een goed boek.,Simon aanvaarde zijn vriendin een goed boek.,Argument Structure,argument_number_ditransitive,1361,een goed boek,adviseerde
De chef schonk de medewerkers een bonus voor hun inzet.,De chef kreeg de medewerkers een bonus voor hun inzet.,Argument Structure,argument_number_ditransitive,1362,een bonus,schonk
Nina beloofde haar ouders een verrassing voor kerst.,Nina geloofde haar ouders een verrassing voor kerst.,Argument Structure,argument_number_ditransitive,1363,een verrassing,beloofde
Victor gaf zijn zusje een lift naar school.,Victor doneerde zijn zusje een lift naar school.,Argument Structure,argument_number_ditransitive,1364,een lift,gaf
De klant stuurde de verkoper een bedankje voor de goede service.,De klant begreep de verkoper een bedankje voor de goede service.,Argument Structure,argument_number_ditransitive,1365,een bedankje,stuurde
Lara vertelde haar vrienden een geheim.,Lara vergat haar vrienden een geheim.,Argument Structure,argument_number_ditransitive,1366,een geheim,vertelde
Maxime schonk haar neefje een fiets voor zijn verjaardag.,Maxime kocht haar neefje een fiets voor zijn verjaardag.,Argument Structure,argument_number_ditransitive,1367,een fiets,schonk
De trainer gaf de sporters een nieuwe oefening.,De trainer trainde de sporters een nieuwe oefening.,Argument Structure,argument_number_ditransitive,1368,een nieuwe oefening,gaf
Kevin stuurde zijn vriendin een liefdesbrief.,Kevin bekeek zijn vriendin een liefdesbrief.,Argument Structure,argument_number_ditransitive,1369,een liefdesbrief,stuurde
De professor legde zijn studenten een moeilijk concept uit.,De professor stoorde zijn studenten een moeilijk concept uit.,Argument Structure,argument_number_ditransitive,1370,een moeilijk concept,legde
Emma bezorgt haar zus een ontbijt op bed.,Emma bemachtigt haar zus een ontbijt op bed.,Argument Structure,argument_number_ditransitive,1371,een ontbijt,bezorgt
Sophie bood haar buurvrouw een lift aan.,Sophie borduurde haar buurvrouw een lift aan.,Argument Structure,argument_number_ditransitive,1372,een lift,bood
De leraar wees de studenten een project toe.,De leraar kreeg de studenten een project toe.,Argument Structure,argument_number_ditransitive,1373,een project,wees
De chef kende de medewerkers een extra vakantiedag toe.,De chef begreep de medewerkers een extra vakantiedag toe.,Argument Structure,argument_number_ditransitive,1374,een extra vakantiedag,kende
Isabel gaf haar zus een make-over voor het feest.,Isabel begreep haar zus een make-over voor het feest.,Argument Structure,argument_number_ditransitive,1375,een make-over,gaf
Jeroen gaf zijn vriendin een romantisch diner.,Jeroen grilde zijn vriendin een romantisch diner.,Argument Structure,argument_number_ditransitive,1376,een romantisch diner,gaf
De therapeut bood de cliënt een luisterend oor.,De therapeut beval de cliënt een luisterend oor.,Argument Structure,argument_number_ditransitive,1377,een luisterend oor.,bood
De chef presenteerde de gasten een culinair hoogstandje.,De chef plaagde de gasten een culinair hoogstandje.,Argument Structure,argument_number_ditransitive,1378,een culinair hoogstandje,presenteerde
De coach bood de atleet een speciaal trainingsprogramma aan.,De coach coachte de atleet een speciaal trainingsprogramma aan.,Argument Structure,argument_number_ditransitive,1379,een speciaal trainingsprogramma,bood
Mark bezorgde zijn vriendin een bos bloemen.,Mark besloot zijn vriendin een bos bloemen.,Argument Structure,argument_number_ditransitive,1380,een bos bloemen,bezorgde
De toerist is laat in de avond gearriveerd bij het verblijf.,De toerist heeft laat in de avond gearriveerd bij het verblijf.,Argument Structure,intransitive_unaccusative_1,61,gearriveerd,is
De bloemen zijn wel heel snel verwelkt met dit weer. ,De bloemen hebben wel heel snel verwelkt met dit weer. ,Argument Structure,intransitive_unaccusative_1,62,verwelkt,zijn
Het schip is vorige week zaterdag gezonken midden op zee.,Het schip heeft vorige week zaterdag gezonken midden op zee.,Argument Structure,intransitive_unaccusative_1,63,gezonken,is
De soldaten zijn een voor een gesneuveld tijdens de oorlog.,De soldaten hebben een voor een gesneuveld tijdens de oorlog.,Argument Structure,intransitive_unaccusative_1,64,gesneuveld,zijn
Het kind is tijdens het spel gestruikeld over een tak.,Het kind heeft tijdens het spel gestruikeld over een tak.,Argument Structure,intransitive_unaccusative_1,65,gestruikeld,is
De muntjes zijn uit haar broekzak gevallen in de achtbaan.,De muntjes hebben uit haar broekzak gevallen in de achtbaan.,Argument Structure,intransitive_unaccusative_1,66,gevallen,zijn
Het bewijs is van het politiebureau verdwenen in de nacht.,Het bewijs heeft van het politiebureau verdwenen in de nacht.,Argument Structure,intransitive_unaccusative_1,67,verdwenen,is
De berichten zijn voor veel geld verschenen in de media.,De berichten hebben voor veel geld verschenen in de media.,Argument Structure,intransitive_unaccusative_1,68,verschenen,zijn
Het rijbewijs is na vijf jaar verlopen vanaf je zeventigste.,Het rijbewijs heeft na vijf jaar verlopen vanaf je zeventigste.,Argument Structure,intransitive_unaccusative_1,69,verlopen,is
De gevangenen zijn in de keuken gestorven door een vechtpartij. ,De gevangenen hebben in de keuken gestorven door een vechtpartij. ,Argument Structure,intransitive_unaccusative_1,70,gestorven,zijn
De bliksem is gisteravond ingeslagen in de oude eik.,De bliksem heeft gisteravond ingeslagen in de oude eik.,Argument Structure,intransitive_unaccusative_1,1381,ingeslagen,is
Het nieuws is vanmorgen bekendgemaakt door de woordvoerder.,Het nieuws heeft vanmorgen bekendgemaakt door de woordvoerder.,Argument Structure,intransitive_unaccusative_1,1382,bekendgemaakt,is
De documenten zijn onlangs ontdekt in het archief.,De documenten hebben onlangs ontdekt in het archief.,Argument Structure,intransitive_unaccusative_1,1383,ontdekt,zijn
De zon is vanachter de wolken tevoorschijn gekomen.,De zon heeft vanachter de wolken tevoorschijn gekomen.,Argument Structure,intransitive_unaccusative_1,1384,tevoorschijn,is
Het feest is vorige week gevierd in het grote kasteel.,Het feest heeft vorige week gevierd in het grote kasteel.,Argument Structure,intransitive_unaccusative_1,1385,gevierd,is
De antwoorden zijn gisteren ontvangen van de examinator.,De antwoorden hebben gisteren ontvangen van de examinator.,Argument Structure,intransitive_unaccusative_1,1386,ontvangen,zijn
De oorzaak is nog niet gevonden door de onderzoekers.,De oorzaak heeft nog niet gevonden door de onderzoekers.,Argument Structure,intransitive_unaccusative_1,1387,gevonden,is
De kinderen zijn vanmorgen aangekomen op school.,De kinderen hebben vanmorgen aangekomen op school.,Argument Structure,intransitive_unaccusative_1,1388,aangekomen,zijn
De foto's zijn per ongeluk gewist tijdens het uploaden.,De foto's hebben per ongeluk gewist tijdens het uploaden.,Argument Structure,intransitive_unaccusative_1,1389,gewist,zijn
Het geld is onverwachts verdwenen uit de kluis.,Het geld heeft onverwachts verdwenen uit de kluis.,Argument Structure,intransitive_unaccusative_1,1390,verdwenen,is
De beslissing is gisteren genomen door het management.,De beslissing heeft gisteren genomen door het management.,Argument Structure,intransitive_unaccusative_1,1391,genomen,is
De vogels zijn plotseling opgevlogen uit de boom.,De vogels hebben plotseling opgevlogen uit de boom.,Argument Structure,intransitive_unaccusative_1,1392,opgevlogen,zijn
De problemen zijn al lang opgelost door het technische team.,De problemen hebben al lang opgelost door het technische team.,Argument Structure,intransitive_unaccusative_1,1393,opgelost,zijn
Het nieuws is vandaag verspreid door de media.,Het nieuws heeft vandaag verspreid door de media.,Argument Structure,intransitive_unaccusative_1,1394,verspreid,is
De toepassing is gisteren geïnstalleerd op de computers.,De toepassing heeft gisteren geïnstalleerd op de computers.,Argument Structure,intransitive_unaccusative_1,1395,geïnstalleerd,is
Het boek is vorige maand uitgebracht door de auteur.,Het boek heeft vorige maand uitgebracht door de auteur.,Argument Structure,intransitive_unaccusative_1,1396,uitgebracht,is
De dieven zijn ontsnapt uit de gevangenis vannacht.,De dieven hebben ontsnapt uit de gevangenis vannacht.,Argument Structure,intransitive_unaccusative_1,1397,ontsnapt,zijn
De fout is direct hersteld door het technische team.,De fout heeft direct hersteld door het technische team.,Argument Structure,intransitive_unaccusative_1,1398,hersteld,is
Het geheim is uiteindelijk onthuld door de hoofdrolspeler.,Het geheim heeft uiteindelijk onthuld door de hoofdrolspeler.,Argument Structure,intransitive_unaccusative_1,1399,onthuld,is
De resultaten zijn eindelijk bereikt na hard werken.,De resultaten hebben eindelijk bereikt na hard werken.,Argument Structure,intransitive_unaccusative_1,1400,bereikt,zijn
De vogels zijn weggevlogen voor de storm uit.,De vogels hebben weggevlogen voor de storm uit.,Argument Structure,intransitive_unaccusative_1,1401,weggevlogen,zijn
Het plan is vorige week goedgekeurd door het bestuur.,Het plan heeft vorige week goedgekeurd door het bestuur.,Argument Structure,intransitive_unaccusative_1,1402,goedgekeurd,is
De vondst is gisteren gemeld door de archeoloog.,De vondst heeft gisteren gemeld door de archeoloog.,Argument Structure,intransitive_unaccusative_1,1403,gemeld,is
De waarheid is vaak verdraaid in de roddels.,De waarheid heeft vaak verdraaid in de roddels.,Argument Structure,intransitive_unaccusative_1,1404,verdraaid,is
De grens is uiteindelijk overschreden door het leger.,De grens heeft uiteindelijk overschreden door het leger.,Argument Structure,intransitive_unaccusative_1,1405,overschreden,is
Het signaal is plotseling verdwenen tijdens de uitzending.,Het signaal heeft plotseling verdwenen tijdens de uitzending.,Argument Structure,intransitive_unaccusative_1,1406,verdwenen,is
De oplossing is gisteren bedacht door de wetenschappers.,De oplossing heeft gisteren bedacht door de wetenschappers.,Argument Structure,intransitive_unaccusative_1,1407,bedacht,is
De opdracht is goed uitgevoerd door de studenten.,De opdracht heeft goed uitgevoerd door de studenten.,Argument Structure,intransitive_unaccusative_1,1408,uitgevoerd,is
De aanwijzingen zijn duidelijk gegeven door de detective.,De aanwijzingen hebben duidelijk gegeven door de detective.,Argument Structure,intransitive_unaccusative_1,1409,gegeven,zijn
De boodschap is vanmiddag bezorgd door de koerier.,De boodschap heeft vanmiddag bezorgd door de koerier.,Argument Structure,intransitive_unaccusative_1,1410,bezorgd,is
Het prachtige kunstwerk is gemaakt door de schilder.,Het prachtige kunstwerk heeft gemaakt door de schilder.,Argument Structure,intransitive_unaccusative_1,1411,gemaakt,is
De heerlijke maaltijd is bereid door de kok.,De heerlijke maaltijd heeft bereid door de kok.,Argument Structure,intransitive_unaccusative_1,1412,bereid,is
Het nieuwe record is gevestigd door de atleet op de sprint.,Het nieuwe record heeft gevestigd door de atleet op de sprint.,Argument Structure,intransitive_unaccusative_1,1413,gevestigd,is
De scriptie is voltooid door de student na maanden van onderzoek.,De scriptie heeft voltooid door de student na maanden van onderzoek.,Argument Structure,intransitive_unaccusative_1,1414,voltooid,is
Het fascinerende verhaal is geschreven door de schrijver.,Het fascinerende verhaal heeft geschreven door de schrijver.,Argument Structure,intransitive_unaccusative_1,1415,geschreven,is
Het verse brood is gebakken door de bakker voor de ochtendverkoop.,Het verse brood heeft gebakken door de bakker voor de ochtendverkoop.,Argument Structure,intransitive_unaccusative_1,1416,gebakken,is
Het prachtige lied is gecomponeerd door de muzikant.,Het prachtige lied heeft gecomponeerd door de muzikant.,Argument Structure,intransitive_unaccusative_1,1417,gecomponeerd,is
De innovatieve oplossing is bedacht door de ingenieur voor het probleem.,De innovatieve oplossing heeft bedacht door de ingenieur voor het probleem.,Argument Structure,intransitive_unaccusative_1,1418,bedacht,is
Het heerlijke dessert is klaargemaakt door de chef-kok voor het diner.,Het heerlijke dessert heeft klaargemaakt door de chef-kok voor het diner.,Argument Structure,intransitive_unaccusative_1,1419,klaargemaakt,is
De indrukwekkende choreografie is uitgevoerd door de danseres.,De indrukwekkende choreografie heeft uitgevoerd door de danseres.,Argument Structure,intransitive_unaccusative_1,1420,uitgevoerd,is
De historische ontdekking is gedaan door de archeoloog.,De historische ontdekking heeft gedaan door de archeoloog.,Argument Structure,intransitive_unaccusative_1,1421,gedaan,is
De ingewikkelde code is geschreven door de programmeur.,De ingewikkelde code heeft geschreven door de programmeur.,Argument Structure,intransitive_unaccusative_1,1422,geschreven,is
De inspirerende lessen zijn voorbereid door de leraar.,De inspirerende lessen hebben voorbereid door de leraar.,Argument Structure,intransitive_unaccusative_1,1423,voorbereid,zijn
De complexe machine is geassembleerd door de ingenieur.,De complexe machine heeft geassembleerd door de ingenieur.,Argument Structure,intransitive_unaccusative_1,1424,geassembleerd,is
Het duurzame ontwerp is bedacht door de architect.,Het duurzame ontwerp heeft bedacht door de architect.,Argument Structure,intransitive_unaccusative_1,1425,bedacht,is
De gedetailleerde kaart is getekend door de cartograaf.,De gedetailleerde kaart heeft getekend door de cartograaf.,Argument Structure,intransitive_unaccusative_1,1426,getekend,is
Het interessante experiment is uitgevoerd door de wetenschapper.,Het interessante experiment heeft uitgevoerd door de wetenschapper.,Argument Structure,intransitive_unaccusative_1,1427,uitgevoerd,is
Het indrukwekkende optreden is gegeven door de artiest.,Het indrukwekkende optreden heeft gegeven door de artiest.,Argument Structure,intransitive_unaccusative_1,1428,gegeven,is
De waardevolle informatie is verstrekt door de expert.,De waardevolle informatie heeft verstrekt door de expert.,Argument Structure,intransitive_unaccusative_1,1429,verstrekt,is
De effectieve methode is toegepast door de specialist.,De effectieve methode heeft toegepast door de specialist.,Argument Structure,intransitive_unaccusative_1,1430,toegepast,is
De realistische simulatie is ontworpen door de ontwikkelaar.,De realistische simulatie heeft ontworpen door de ontwikkelaar.,Argument Structure,intransitive_unaccusative_1,1431,ontworpen,is
Het gedetailleerde plan is opgesteld door de planner.,Het gedetailleerde plan heeft opgesteld door de planner.,Argument Structure,intransitive_unaccusative_1,1432,opgesteld,is
De nauwkeurige metingen zijn verricht door de wetenschapper.,De nauwkeurige metingen hebben verricht door de wetenschapper.,Argument Structure,intransitive_unaccusative_1,1433,verricht,zijn
Het effectieve programma is ontwikkeld voor kinderen.,Het effectieve programma heeft ontwikkeld voor kinderen.,Argument Structure,intransitive_unaccusative_1,1434,ontwikkeld,is
Het complexe model is gebouwd voor de tentoonstelling.,Het complexe model heeft gebouwd voor de tentoonstelling.,Argument Structure,intransitive_unaccusative_1,1435,gebouwd,is
