sentence_good,sentence_bad,linguistic_phenomenon,paradigm,item_id,critical_word,cue_word
De waardevolle inzichten zijn verkregen door de onderzoeker.,De waardevolle inzichten hebben verkregen door de onderzoeker.,Argument Structure,intransitive_unaccusative_1,1436,verkregen,zijn
De vogels zijn 's ochtends vroeg teruggekeerd naar hun nest.,De vogels hebben 's ochtends vroeg teruggekeerd naar hun nest.,Argument Structure,intransitive_unaccusative_1,1437,teruggekeerd,zijn
Het concert is gisteravond begonnen in de concertzaal.,Het concert heeft gisteravond begonnen in de concertzaal.,Argument Structure,intransitive_unaccusative_1,1438,begonnen,is
De regen is plotseling gestopt tijdens de picknick.,De regen heeft plotseling gestopt tijdens de picknick.,Argument Structure,intransitive_unaccusative_1,1439,gestopt,is
Het verhaal is vanmorgen verteld aan de kinderen.,Het verhaal heeft vanmorgen verteld aan de kinderen.,Argument Structure,intransitive_unaccusative_1,1440,verteld,is
De sterren zijn één voor één verschenen in de donkere lucht.,De sterren hebben één voor één verschenen in de donkere lucht.,Argument Structure,intransitive_unaccusative_1,1441,verschenen,zijn
De ballonnen zijn leeggelopen tijdens het feest.,De ballonnen hebben leeggelopen tijdens het feest.,Argument Structure,intransitive_unaccusative_1,1442,leeggelopen,zijn
De markt is vandaag geopend voor het publiek.,De markt heeft vandaag geopend voor het publiek.,Argument Structure,intransitive_unaccusative_1,1443,geopend,is
De mist is langzaam opgetrokken boven het meer.,De mist heeft langzaam opgetrokken boven het meer.,Argument Structure,intransitive_unaccusative_1,1444,opgetrokken,is
De trein is op tijd vertrokken van het station.,De trein heeft op tijd vertrokken van het station.,Argument Structure,intransitive_unaccusative_1,1445,vertrokken,is
De bloemen zijn in de ochtend geplukt voor het boeket.,De bloemen hebben in de ochtend geplukt voor het boeket.,Argument Structure,intransitive_unaccusative_1,1446,geplukt,zijn
De klok is op tijd geluid voor de ceremonie.,De klok heeft op tijd geluid voor de ceremonie.,Argument Structure,intransitive_unaccusative_1,1447,geluid,is
Het vuurwerk is vanavond afgestoken tijdens het evenement.,Het vuurwerk heeft vanavond afgestoken tijdens het evenement.,Argument Structure,intransitive_unaccusative_1,1448,afgestoken,is
De bel is luid en duidelijk gehoord in de hele school.,De bel heeft luid en duidelijk gehoord in de hele school.,Argument Structure,intransitive_unaccusative_1,1449,gehoord,is
Het toneelstuk is gisteren opgevoerd in het theater.,Het toneelstuk heeft gisteren opgevoerd in het theater.,Argument Structure,intransitive_unaccusative_1,1450,opgevoerd,is
De dieren zijn 's nachts tot rust gekomen in het bos.,De dieren hebben 's nachts tot rust gekomen in het bos.,Argument Structure,intransitive_unaccusative_1,1451,gekomen,zijn
De ballen zijn snel gerold tijdens het spel.,De ballen hebben snel gerold tijdens het spel.,Argument Structure,intransitive_unaccusative_1,1452,gerold,zijn
De lichten zijn plotseling gedoofd tijdens de voorstelling.,De lichten hebben plotseling gedoofd tijdens de voorstelling.,Argument Structure,intransitive_unaccusative_1,1453,gedoofd,zijn
De woorden zijn langzaam gesproken tijdens de toespraak.,De woorden hebben langzaam gesproken tijdens de toespraak.,Argument Structure,intransitive_unaccusative_1,1454,gesproken,zijn
De route is duidelijk aangegeven tijdens de wandeling.,De route heeft duidelijk aangegeven tijdens de wandeling.,Argument Structure,intransitive_unaccusative_1,1455,aangegeven,is
De tijd is snel voorbijgegaan tijdens de vakantie.,De tijd heeft snel voorbijgegaan tijdens de vakantie.,Argument Structure,intransitive_unaccusative_1,1456,voorbijgegaan,is
De kaarsen zijn langzaam uitgebrand tijdens het romantische diner.,De kaarsen hebben langzaam uitgebrand tijdens het romantische diner.,Argument Structure,intransitive_unaccusative_1,1457,uitgebrand,zijn
De zon is vanochtend opgekomen over de horizon.,De zon heeft vanochtend opgekomen over de horizon.,Argument Structure,intransitive_unaccusative_1,1458,opgekomen,is
De koffie is vanmiddag gezet in de koffiebar.,De koffie heeft vanmiddag gezet in de koffiebar.,Argument Structure,intransitive_unaccusative_1,1459,gezet,is
De vissen zijn snel weggezwommen bij het naderen van de haai.,De vissen hebben snel weggezwommen bij het naderen van de haai.,Argument Structure,intransitive_unaccusative_1,1460,weggezwommen,zijn
De vuren zijn 's nachts ontstoken tijdens het midzomernachtfeest.,De vuren hebben 's nachts ontstoken tijdens het midzomernachtfeest.,Argument Structure,intransitive_unaccusative_1,1461,ontstoken,zijn
De rivier is in de winter bevroren door de koude temperatuur.,De rivier heeft in de winter bevroren door de koude temperatuur.,Argument Structure,intransitive_unaccusative_1,1462,bevroren,is
De bloemen zijn vroeg in de lente ontloken in de tuin.,De bloemen hebben vroeg in de lente ontloken in de tuin.,Argument Structure,intransitive_unaccusative_1,1463,ontloken,zijn
De boeken zijn gelezen tijdens de lange winteravonden.,De boeken hebben gelezen tijdens de lange winteravonden.,Argument Structure,intransitive_unaccusative_1,1464,gelezen,zijn
Het geduld is op de proef gesteld tijdens het wachten.,Het geduld heeft op de proef gesteld tijdens het wachten.,Argument Structure,intransitive_unaccusative_1,1465,gesteld,is
De jaren zijn snel voorbijgevlogen in het kleine dorp.,De jaren hebben snel voorbijgevlogen in het kleine dorp.,Argument Structure,intransitive_unaccusative_1,1466,voorbijgevlogen,zijn
De kikkers zijn kwaakconcerten begonnen bij het meer.,De kikkers hebben kwaakconcerten begonnen bij het meer.,Argument Structure,intransitive_unaccusative_1,1467,begonnen,zijn
De wijn is laat in de nacht geschonken bij het diner.,De wijn heeft laat in de nacht geschonken bij het diner.,Argument Structure,intransitive_unaccusative_1,1468,geschonken,is
De lichten zijn uitgegaan na het laatste nummer van het concert.,De lichten hebben uitgegaan na het laatste nummer van het concert.,Argument Structure,intransitive_unaccusative_1,1469,uitgegaan,zijn
De herfstbladeren zijn neergevallen op het tuinpad.,De herfstbladeren hebben neergevallen op het tuinpad.,Argument Structure,intransitive_unaccusative_1,1470,neergevallen,zijn
Amy heeft tot haar vijftiende gedanst op professioneel niveau.,Amy is tot haar vijftiende gedanst op professioneel niveau.,Argument Structure,intransitive_unaccusative_2,71,gedanst,heeft
Alexander heeft heel erg hard gelachen tijdens de show.,Alexander is heel erg hard gelachen tijdens de show.,Argument Structure,intransitive_unaccusative_2,72,gelachen,heeft
Casper heeft heel erg goed geslapen in het hotel.,Casper is heel erg goed geslapen in het hotel.,Argument Structure,intransitive_unaccusative_2,73,geslapen,heeft
Bente heeft twee weken lang gehoest door haar verkoudheid.,Bente is twee weken lang gehoest door haar verkoudheid.,Argument Structure,intransitive_unaccusative_2,74,gehoest,heeft
Elias heeft over leuke dingen gedroomd de afgelopen nachten.,Elias is over leuke dingen gedroomd de afgelopen nachten.,Argument Structure,intransitive_unaccusative_2,75,gedroomd,heeft
Bas en Carlijn hebben tijdens de vakantie gegiecheld aan de bar.,Bas en Carlijn zijn tijdens de vakantie gegiecheld aan de bar.,Argument Structure,intransitive_unaccusative_2,76,gegiecheld,hebben
Eva en Dylan hebben met hun vriendengroep gepraat over de ruzie.,Eva en Dylan zijn met hun vriendengroep gepraat over de ruzie.,Argument Structure,intransitive_unaccusative_2,77,gepraat,hebben
Floris en Dewi hebben tijdens de tentoonstelling gefaald met hun opdracht.,Floris en Dewi zijn tijdens de tentoonstelling gefaald met hun opdracht.,Argument Structure,intransitive_unaccusative_2,78,gefaald,hebben
Fenna en Huub hebben beide toch stiekem gehuild bij de voorstelling.,Fenna en Huub zijn beide toch stiekem gehuild bij de voorstelling.,Argument Structure,intransitive_unaccusative_2,79,gehuild,hebben
Guus en Isabel hebben met een groep gezweet tijdens een sportles.,Guus en Isabel zijn met een groep gezweet tijdens een sportles.,Argument Structure,intransitive_unaccusative_2,80,gezweet,hebben
Tim heeft gisteravond gitaar gespeeld in het café.,Tim is gisteravond gitaar gespeeld in het café.,Argument Structure,intransitive_unaccusative_2,1471,gespeeld,heeft
Nina heeft de hele dag gewinkeld in de stad.,Nina is de hele dag gewinkeld in de stad.,Argument Structure,intransitive_unaccusative_2,1472,gewinkeld,heeft
Joris heeft hard gelopen in het park.,Joris is hard gelopen in het park.,Argument Structure,intransitive_unaccusative_2,1473,gelopen,heeft
Elise heeft vroeg opengedaan voor de bezorger.,Elise is vroeg opengedaan voor de bezorger.,Argument Structure,intransitive_unaccusative_2,1474,opengedaan,heeft
Thijs heeft de hele nacht gestudeerd voor het examen.,Thijs is de hele nacht gestudeerd voor het examen.,Argument Structure,intransitive_unaccusative_2,1475,gestudeerd,heeft
Linda heeft lang in de file gestaan vanmorgen.,Linda is lang in de file gestaan vanmorgen.,Argument Structure,intransitive_unaccusative_2,1476,gestaan,heeft
Martijn heeft de hele film gekeken zonder te pauzeren.,Martijn is de hele film gekeken zonder te pauzeren.,Argument Structure,intransitive_unaccusative_2,1477,gekeken,heeft
Sophie heeft met passie gezongen tijdens het concert.,Sophie is met passie gezongen tijdens het concert.,Argument Structure,intransitive_unaccusative_2,1478,gezongen,heeft
Sander heeft de hele nacht gewacht op de trein.,Sander is de hele nacht gewacht op de trein.,Argument Structure,intransitive_unaccusative_2,1479,gewacht,heeft
Rick heeft de hele dag getekend in zijn schetsboek.,Rick is de hele dag getekend in zijn schetsboek.,Argument Structure,intransitive_unaccusative_2,1480,getekend,heeft
Marloes heeft met volle teugen genoten van het concert.,Marloes is met volle teugen genoten van het concert.,Argument Structure,intransitive_unaccusative_2,1481,genoten,heeft
Thomas heeft veel gelachen om de grappen van zijn vrienden.,Thomas is veel gelachen om de grappen van zijn vrienden.,Argument Structure,intransitive_unaccusative_2,1482,gelachen,heeft
Anouk heeft vroeg ontbeten vanochtend.,Anouk is vroeg ontbeten vanochtend.,Argument Structure,intransitive_unaccusative_2,1483,ontbeten,heeft
Jasper heeft tot laat gewerkt aan het project.,Jasper is tot laat gewerkt aan het project.,Argument Structure,intransitive_unaccusative_2,1484,gewerkt,heeft
Julia heeft gisteren met haar broer gespeeld in de tuin.,Julia is gisteren met haar broer gespeeld in de tuin.,Argument Structure,intransitive_unaccusative_2,1485,gespeeld,heeft
Sanne heeft de hele dag gepuzzeld.,Sanne is de hele dag gepuzzeld.,Argument Structure,intransitive_unaccusative_2,1486,gepuzzeld,heeft
Nick heeft met overgave gedanst op het feest.,Nick is met overgave gedanst op het feest.,Argument Structure,intransitive_unaccusative_2,1487,gedanst,heeft
Lotte heeft gisteren met haar vrienden gebarbecued.,Lotte is gisteren met haar vrienden gebarbecued.,Argument Structure,intransitive_unaccusative_2,1488,gebarbecued,heeft
Daan heeft de hele middag geschaakt met zijn opa.,Daan is de hele middag geschaakt met zijn opa.,Argument Structure,intransitive_unaccusative_2,1489,geschaakt,heeft
Mart heeft vandaag in de regen gelopen naar huis.,Mart is vandaag in de regen gelopen naar huis.,Argument Structure,intransitive_unaccusative_2,1490,gelopen,heeft
Mila heeft de hele avond geluisterd naar muziek.,Mila is de hele avond geluisterd naar muziek.,Argument Structure,intransitive_unaccusative_2,1491,geluisterd,heeft
Jordy heeft gisteren met zijn neefje gespeeld.,Jordy is gisteren met zijn neefje gespeeld.,Argument Structure,intransitive_unaccusative_2,1492,gespeeld,heeft
Lotte heeft in de zon gelegen op het strand.,Lotte is in de zon gelegen op het strand.,Argument Structure,intransitive_unaccusative_2,1493,gelegen,heeft
Lars heeft de hele dag gewerkt aan zijn scriptie.,Lars is de hele dag gewerkt aan zijn scriptie.,Argument Structure,intransitive_unaccusative_2,1494,gewerkt,heeft
Nina heeft met bewondering gekeken naar de kunstwerken.,Nina is met bewondering gekeken naar de kunstwerken.,Argument Structure,intransitive_unaccusative_2,1495,gekeken,heeft
Lucas heeft gisteren met zijn vrienden gevoetbald.,Lucas is gisteren met zijn vrienden gevoetbald.,Argument Structure,intransitive_unaccusative_2,1496,gevoetbald,heeft
Het gebouw heeft gebeefd door de zware vrachtwagen.,Het gebouw is gebeefd door de zware vrachtwagen.,Argument Structure,intransitive_unaccusative_2,1497,gebeefd,heeft
Iris heeft de hele dag gesurft op het internet.,Iris is de hele dag gesurft op het internet.,Argument Structure,intransitive_unaccusative_2,1498,gesurft,heeft
Niels heeft de hele dag geskateboard in het park.,Niels is de hele dag geskateboard in het park.,Argument Structure,intransitive_unaccusative_2,1499,geskateboard,heeft
Laura heeft gisteren met haar zus gewinkeld.,Laura is gisteren met haar zus gewinkeld.,Argument Structure,intransitive_unaccusative_2,1500,gewinkeld,heeft
Tim heeft met enthousiasme gesproken tijdens de presentatie.,Tim is met enthousiasme gesproken tijdens de presentatie.,Argument Structure,intransitive_unaccusative_2,1501,gesproken,heeft
Lisa heeft naar de winkel gelopen.,Lisa is naar de winkel gelopen.,Argument Structure,intransitive_unaccusative_2,1502,gelopen,heeft
Tom heeft naar de bushalte gerend.,Tom is naar de bushalte gerend.,Argument Structure,intransitive_unaccusative_2,1503,gerend,heeft
Peter heeft de hele dag op de bank gezeten.,Peter is de hele dag op de bank gezeten.,Argument Structure,intransitive_unaccusative_2,1504,gezeten,heeft
Emma heeft de hele speech gestaan.,Emma is de hele speech gestaan.,Argument Structure,intransitive_unaccusative_2,1505,gestaan,heeft
De boeken hebben op het bureau gelegen.,De boeken zijn op het bureau gelegen.,Argument Structure,intransitive_unaccusative_2,1506,gelegen,hebben
Max heeft over het hek gesprongen.,Max is over het hek gesprongen.,Argument Structure,intransitive_unaccusative_2,1507,gesprongen,heeft
Julia heeft de berg beklommen.,Julia is de berg beklommen.,Argument Structure,intransitive_unaccusative_2,1508,beklommen,heeft
Mark heeft in de diepe poel gedoken.,Mark is in de diepe poel gedoken.,Argument Structure,intransitive_unaccusative_2,1509,gedoken,heeft
Emma heeft de hele film gehuild.,Emma is de hele film gehuild.,Argument Structure,intransitive_unaccusative_2,1510,gehuild,heeft
Lars heeft hardop gelachen om de grap.,Lars is hardop gelachen om de grap.,Argument Structure,intransitive_unaccusative_2,1511,gelachen,heeft
Sophie heeft vriendelijk geglimlacht.,Sophie is vriendelijk geglimlacht.,Argument Structure,intransitive_unaccusative_2,1512,geglimlacht,heeft
Tom heeft geeuwend naar het plafond gestaard.,Tom is geeuwend naar het plafond gestaard.,Argument Structure,intransitive_unaccusative_2,1513,gestaard,heeft
Sarah heeft geschreeuwd van vreugde.,Sarah is geschreeuwd van vreugde.,Argument Structure,intransitive_unaccusative_2,1514,geschreeuwd,heeft
Lisa heeft zachtjes gefluisterd.,Lisa is zachtjes gefluisterd.,Argument Structure,intransitive_unaccusative_2,1515,gefluisterd,heeft
Tim heeft naar zijn vriend gezwaaid.,Tim is naar zijn vriend gezwaaid.,Argument Structure,intransitive_unaccusative_2,1516,gezwaaid,heeft
De kinderen hebben naar de vogels gekeken.,De kinderen zijn naar de vogels gekeken.,Argument Structure,intransitive_unaccusative_2,1517,gekeken,hebben
Nina heeft naar muziek geluisterd.,Nina is naar muziek geluisterd.,Argument Structure,intransitive_unaccusative_2,1518,geluisterd,heeft
Eva heeft aan de bloemen geroken.,Eva is aan de bloemen geroken.,Argument Structure,intransitive_unaccusative_2,1519,geroken,heeft
Bas heeft de nieuwe smaak ijs geproefd.,Bas is de nieuwe smaak ijs geproefd.,Argument Structure,intransitive_unaccusative_2,1520,geproefd,heeft
Amy heeft diep nagedacht over de vraag.,Amy is diep nagedacht over de vraag.,Argument Structure,intransitive_unaccusative_2,1521,nagedacht,heeft
Chris heeft over een fantastisch avontuur gedroomd.,Chris is over een fantastisch avontuur gedroomd.,Argument Structure,intransitive_unaccusative_2,1522,gedroomd,heeft
Sophie heeft diep geslapen.,Sophie is diep geslapen.,Argument Structure,intransitive_unaccusative_2,1523,geslapen,heeft
Mark heeft zich ontspannen tijdens de vakantie.,Mark is zich ontspannen tijdens de vakantie.,Argument Structure,intransitive_unaccusative_2,1524,ontspannen,heeft
Lisa heeft zich gehaast om de trein te halen.,Lisa is zich gehaast om de trein te halen.,Argument Structure,intransitive_unaccusative_2,1525,gehaast,heeft
De windmolen heeft snel gedraaid.,De windmolen is snel gedraaid.,Argument Structure,intransitive_unaccusative_2,1526,gedraaid,heeft
Anna heeft diep gebogen voor haar publiek.,Anna is diep gebogen voor haar publiek.,Argument Structure,intransitive_unaccusative_2,1527,gebogen,heeft
Kees en Tim hebben op de deur geklopt.,Kees en Tim zijn op de deur geklopt.,Argument Structure,intransitive_unaccusative_2,1528,geklopt,hebben
Het harde geluid heeft in de kamer gebonsd.,Het harde geluid is in de kamer gebonsd.,Argument Structure,intransitive_unaccusative_2,1529,gebonsd,heeft
De telefoon heeft op de tafel getrild.,De telefoon is op de tafel getrild.,Argument Structure,intransitive_unaccusative_2,1530,getrild,heeft
De aarde heeft gebeefd tijdens de aardbeving.,De aarde is gebeefd tijdens de aardbeving.,Argument Structure,intransitive_unaccusative_2,1531,gebeefd,heeft
De kinderen hebben gegleden op het ijs.,De kinderen zijn gegleden op het ijs.,Argument Structure,intransitive_unaccusative_2,1532,gegleden,hebben
De baby heeft voor het eerst gekropen.,De baby is voor het eerst gekropen.,Argument Structure,intransitive_unaccusative_2,1533,gekropen,heeft
De kat heeft geruisloos geslopen door het gras.,De kat is geruisloos geslopen door het gras.,Argument Structure,intransitive_unaccusative_2,1534,geslopen,heeft
De bal heeft langzaam gerold.,De bal is langzaam gerold.,Argument Structure,intransitive_unaccusative_2,1535,gerold,heeft
De tol heeft snel rondgetold.,De tol is snel rondgetold.,Argument Structure,intransitive_unaccusative_2,1536,rondgetold,heeft
De kat heeft tevreden gespind.,De kat is tevreden gespind.,Argument Structure,intransitive_unaccusative_2,1537,gespind,heeft
Ze heeft met een glimlach geknikt.,Ze is met een glimlach geknikt.,Argument Structure,intransitive_unaccusative_2,1538,geknikt,heeft
Max heeft stiekem naar binnen gegluurd.,Max is stiekem naar binnen gegluurd.,Argument Structure,intransitive_unaccusative_2,1539,gegluurd,heeft
De vogel heeft nieuwsgierig naar buiten getuurd.,De vogel is nieuwsgierig naar buiten getuurd.,Argument Structure,intransitive_unaccusative_2,1540,getuurd,heeft
Lisa heeft naar de sterren gestaard.,Lisa is naar de sterren gestaard.,Argument Structure,intransitive_unaccusative_2,1541,gestaard,heeft
Sophie heeft met haar ogen geknipperd.,Sophie is met haar ogen geknipperd.,Argument Structure,intransitive_unaccusative_2,1542,geknipperd,heeft
Emma en Tim hebben naar de kaart gewezen.,Emma en Tim zijn naar de kaart gewezen.,Argument Structure,intransitive_unaccusative_2,1543,gewezen,hebben
Mark heeft besloten te zwijgen.,Mark is besloten te zwijgen.,Argument Structure,intransitive_unaccusative_2,1544,besloten,heeft
Lisa heeft hartelijk geschaterd om de grap.,Lisa is hartelijk geschaterd om de grap.,Argument Structure,intransitive_unaccusative_2,1545,geschaterd,heeft
De kinderen hebben samen gegniffeld.,De kinderen zijn samen gegniffeld.,Argument Structure,intransitive_unaccusative_2,1546,gegniffeld,hebben
De kat heeft luid gesnurkt op de bank.,De kat is luid gesnurkt op de bank.,Argument Structure,intransitive_unaccusative_2,1547,gesnurkt,heeft
Emma heeft diep gezucht van vermoeidheid.,Emma is diep gezucht van vermoeidheid.,Argument Structure,intransitive_unaccusative_2,1548,gezucht,heeft
Max heeft beleefd gekucht tijdens de presentatie.,Max is beleefd gekucht tijdens de presentatie.,Argument Structure,intransitive_unaccusative_2,1549,gekucht,heeft
Lisa heeft boos gesist naar haar broer.,Lisa is boos gesist naar haar broer.,Argument Structure,intransitive_unaccusative_2,1550,gesist,heeft
De oude motor heeft luid gebromd.,De oude motor is luid gebromd.,Argument Structure,intransitive_unaccusative_2,1551,gebromd,heeft
De bijen hebben vrolijk gezoemd in de tuin.,De bijen zijn vrolijk gezoemd in de tuin.,Argument Structure,intransitive_unaccusative_2,1552,gezoemd,hebben
De wind heeft door de bomen gesuisd.,De wind is door de bomen gesuisd.,Argument Structure,intransitive_unaccusative_2,1553,gesuisd,heeft
De camera heeft snel geflitst.,De camera is snel geflitst.,Argument Structure,intransitive_unaccusative_2,1554,geflitst,heeft
De diamanten hebben in het licht gefonkeld.,De diamanten zijn in het licht gefonkeld.,Argument Structure,intransitive_unaccusative_2,1555,gefonkeld,hebben
De neonlichten hebben fel geknipperd.,De neonlichten zijn fel geknipperd.,Argument Structure,intransitive_unaccusative_2,1556,geknipperd,hebben
De zaklamp heeft in de duisternis geschenen.,De zaklamp is in de duisternis geschenen.,Argument Structure,intransitive_unaccusative_2,1557,geschenen,heeft
De kolen hebben roodgloeiend gebrand.,De kolen zijn roodgloeiend gebrand.,Argument Structure,intransitive_unaccusative_2,1558,gebrand,hebben
De stoelen hebben over de vloer geschoven.,De stoelen zijn over de vloer geschoven.,Argument Structure,intransitive_unaccusative_2,1559,geschoven,hebben
Anna heeft snel door de tv-kanalen gezapt.,Anna is snel door de tv-kanalen gezapt.,Argument Structure,intransitive_unaccusative_2,1560,gezapt,snel
De pomp heeft de hele dag gelekt op de vloerbedekking.,De pomp is de hele dag gelekt op de vloerbedekking.,Argument Structure,intransitive_unaccusative_3,81,gelekt,heeft
De lampen hebben de hele week geflikkerd in de woonkamer.,De lampen zijn de hele week geflikkerd in de woonkamer.,Argument Structure,intransitive_unaccusative_3,82,geflikkerd,hebben
De bootjes hebben de hele vakantie gedreven op het water.,De bootjes zijn de hele vakantie gedreven op het water.,Argument Structure,intransitive_unaccusative_3,83,gedreven,hebben
Het eten heeft heel erg lang gerot in de zon.,Het eten is heel erg lang gerot in de zon.,Argument Structure,intransitive_unaccusative_3,84,gerot,heeft
Het vuur heeft een lange tijd gebrand voor de tent.,Het vuur is een lange tijd gebrand voor de tent.,Argument Structure,intransitive_unaccusative_3,85,gebrand,heeft
De zee heeft al jaren lang geschuimd op het strand.,De zee is al jaren land geschuimd op het strand.,Argument Structure,intransitive_unaccusative_3,86,geschuimd,heeft
De kinderen hebben heel de autorit gestonken door de gymles.,De kinderen zijn heel de autorit gestonken door de gymles.,Argument Structure,intransitive_unaccusative_3,87,gestonken,hebben
De wonden hebben voor lange tijd gebloed na de val.,De wonden zijn voor lange tijd gebloed na de val.,Argument Structure,intransitive_unaccusative_3,88,gebloed,hebben
De pijp heeft waarschijnlijk al maanden gelekt voor de reparatie.,De pijp is waarschijnlijk al maanden gelekt voor de reparatie.,Argument Structure,intransitive_unaccusative_3,89,gelekt,heeft
De shirts hebben een week lang gestonken na de wedstrijd.,De shirts zijn een week lang gestonken na de wedstrijd.,Argument Structure,intransitive_unaccusative_3,90,gestonken,hebben
De bloemen hebben de hele dag gegeurd in de kamer.,De bloemen zijn de hele dag gegeurd in de kamer.,Argument Structure,intransitive_unaccusative_3,1561,gegeurd,hebben
De computer heeft de hele nacht gedraaid zonder problemen.,De computer is de hele nacht gedraaid zonder problemen.,Argument Structure,intransitive_unaccusative_3,1562,gedraaid,heeft
De klok heeft uren getikt in de stille kamer.,De klok is uren getikt in de stille kamer.,Argument Structure,intransitive_unaccusative_3,1563,getikt,heeft
De bomen hebben wekenlang gewapperd in de wind.,De bomen zijn wekenlang gewapperd in de wind.,Argument Structure,intransitive_unaccusative_3,1564,gewapperd,hebben
De auto heeft de hele rit geronkt door de kapotte uitlaat.,De auto is de hele rit geronkt door de kapotte uitlaat.,Argument Structure,intransitive_unaccusative_3,1565,geronkt,heeft
De zon heeft de hele middag geschenen in de tuin.,De zon is de hele middag geschenen in de tuin.,Argument Structure,intransitive_unaccusative_3,1566,geschenen,heeft
De muur heeft dagenlang gestonken na het schilderen.,De muur is dagenlang gestonken na het schilderen.,Argument Structure,intransitive_unaccusative_3,1567,gestonken,heeft
De regen heeft de hele nacht gekletterd op het dak.,De regen is de hele nacht gekletterd op het dak.,Argument Structure,intransitive_unaccusative_3,1568,gekletterd,heeft
De geruchten hebben wekenlang gecirculeerd in de buurt.,De geruchten zijn wekenlang gecirculeerd in de buurt.,Argument Structure,intransitive_unaccusative_3,1569,gecirculeerd,hebben
De kinderen hebben urenlang gespeeld in de tuin.,De kinderen zijn urenlang gespeeld in de tuin.,Argument Structure,intransitive_unaccusative_3,1570,gespeeld,hebben
De vogels hebben de hele dag gezongen in de boom.,De vogels zijn de hele dag gezongen in de boom.,Argument Structure,intransitive_unaccusative_3,1571,gezongen,hebben
De vlekken hebben dagenlang op de kleding gezeten .,De vlekken zijn dagenlang op de kleding gezeten.,Argument Structure,intransitive_unaccusative_3,1572,gezeten,hebben
De sneeuwvlokken hebben de hele dag gedwarreld in de lucht.,De sneeuwvlokken zijn de hele dag gedwarreld in de lucht.,Argument Structure,intransitive_unaccusative_3,1573,gedwarreld,hebben
De vis heeft een hele tijd gesparteld op het droge.,De vis is een hele tijd gesparteld op het droge.,Argument Structure,intransitive_unaccusative_3,1574,gesparteld,heeft
De geur heeft urenlang gehangen in de keuken.,De geur is urenlang gehangen in de keuken.,Argument Structure,intransitive_unaccusative_3,1575,gehangen,heeft
