sentence_good,sentence_bad,linguistic_phenomenon,paradigm,item_id,critical_word,cue_word
Adam bezoekt graag af en toe een museum tijdens de vakantie.,Adam loopt graag af en toe een museum tijdens de vakantie.,Argument Structure,argument_number_(in)transitive,41,een museum,bezoekt
Bram behandelt graag op verschillende momenten de vragen in een college.,Bram focust graag op verschillende momenten de vragen in een college.,Argument Structure,argument_number_(in)transitive,42,de vragen,behandelt
Cas beantwoordt in een mum van tijd zijn e-mail op zijn laptop.,Cas reageert in een mum van tijd zijn e-mail op zijn laptop.,Argument Structure,argument_number_(in)transitive,43,zijn e-mail,beantwoordt
Daan vermoordt de hele tijd alle monsters in zijn spelletje.,Daan overlijdt de hele tijd alle monsters in zijn spelletje.,Argument Structure,argument_number_(in)transitive,44,alle monsters,vermoordt
Emir maakt vaak in het weekend een taart voor de visite.,Emir zit vaak in het weekend een taart voor de visite.,Argument Structure,argument_number_(in)transitive,45,een taart,maakt
Fleur doneert iedere maand wat kleren aan goede doelen.,Fleur voetbalt iedere maand wat kleren aan goede doelen.,Argument Structure,argument_number_(in)transitive,46,wat kleren,doneert
Gwen aait altijd overal de huisdieren voor lange tijd.  ,Gwen ligt altijd overal de huisdieren voor lange tijd.  ,Argument Structure,argument_number_(in)transitive,47,de huisdieren,aait
Hanna contacteert bij ieder ongeval de nabestaanden op korte termijn.,Hanna zit bij ieder ongeval de nabestaanden op korte termijn.,Argument Structure,argument_number_(in)transitive,48,de nabestaanden,contacteert
Iris ziet vaak meerdere keren per week haar oma in het bejaardentehuis.,Iris kijkt vaak meerdere keren per week haar oma in het bejaardentehuis.,Argument Structure,argument_number_(in)transitive,49,haar oma,ziet
Julia verhuurt de komende drie maanden haar woning in het centrum.,Julia focust de komende drie maanden haar woning in het centrum.,Argument Structure,argument_number_(in)transitive,50,haar woning,verhuurt
Kevin schildert regelmatig landschappen op doek.,Kevin focust regelmatig landschappen op doek.,Argument Structure,argument_number_(in)transitive,1201,landschappen,schildert
Laura bekijkt elk weekend een film in de bioscoop.,Laura kijkt elk weekend een film in de bioscoop.,Argument Structure,argument_number_(in)transitive,1202,een film,bekijkt
Max beluistert dagelijks muziek op zijn nieuwe koptelefoon.,Max reageert dagelijks muziek op zijn nieuwe koptelefoon.,Argument Structure,argument_number_(in)transitive,1203,muziek,beluistert
Noa bezoekt elke zomer een pretpark met haar vrienden.,Noa rent elke zomer een pretpark met haar vrienden.,Argument Structure,argument_number_(in)transitive,1204,een pretpark,bezoekt
Puck leest wekelijks een nieuw boek in haar vrije tijd.,Puck werkt wekelijks een nieuw boek in haar vrije tijd.,Argument Structure,argument_number_(in)transitive,1205,een nieuw boek,leest
Quirine beoefent maandelijks yoga voor ontspanning.,Quirine schrikt maandelijks yoga voor ontspanning.,Argument Structure,argument_number_(in)transitive,1206,yoga,beoefent
Simone maakt maandelijks zelfgemaakte sieraden voor haar vriendinnen.,Simone werkt maandelijks zelfgemaakte sieraden voor haar vriendinnen.,Argument Structure,argument_number_(in)transitive,1207,zelfgemaakte sieraden,maakt
Thijs fotografeert graag bloemen in de natuur.,Thijs abonneert graag bloemen in de natuur.,Argument Structure,argument_number_(in)transitive,1208,bloemen,fotografeert
Utrecht organiseert jaarlijks een grote kerstmarkt in het centrum.,Utrecht verslikt jaarlijks een grote kerstmarkt in het centrum.,Argument Structure,argument_number_(in)transitive,1209,een grote kerstmarkt,organiseert
Vera speelt elke zondag een potje schaak met haar opa.,Vera springt elke zondag een potje schaak met haar opa.,Argument Structure,argument_number_(in)transitive,1210,een potje schaak,speelt
Xander bakt wekelijks taarten voor zijn vrienden.,Xander slaapt wekelijks taarten voor zijn vrienden.,Argument Structure,argument_number_(in)transitive,1211,taarten,bakt
Dominique traint wekelijks haar conditie voor een hardloopwedstrijd.,Dominique stopt wekelijks haar conditie voor een hardloopwedstrijd.,Argument Structure,argument_number_(in)transitive,1212,haar conditie,traint
Klaas repareert regelmatig zijn fiets in de garage.,Klaas rent regelmatig zijn fiets in de garage.,Argument Structure,argument_number_(in)transitive,1213,zijn fiets,repareert
Maarten onderhoudt dagelijks zijn tuin met veel zorg.,Maarten denkt dagelijks zijn tuin met veel zorg.,Argument Structure,argument_number_(in)transitive,1214,zijn tuin,onderhoudt
Nina programmeert elke week nieuwe functies voor haar app.,Nina schaakt elke week nieuwe functies voor haar app.,Argument Structure,argument_number_(in)transitive,1215,nieuwe functies,programmeert
Owen publiceert maandelijks interessante artikelen op zijn blog.,Owen rent maandelijks interessante artikelen op zijn blog.,Argument Structure,argument_number_(in)transitive,1216,interessante artikelen,publiceert
Patricia verzorgt altijd haar planten op het balkon.,Patricia vliegt altijd haar planten op het balkon.,Argument Structure,argument_number_(in)transitive,1217,haar planten,verzorgt
Rachel analyseert elk kwartaal de financiële resultaten van haar bedrijf.,Rachel feest elk kwartaal de financiële resultaten van haar bedrijf.,Argument Structure,argument_number_(in)transitive,1218,de financiële resultaten,analyseert
Sander bewerkt wekelijks zijn foto's voor zijn fotogalerij.,Sander ligt wekelijks zijn foto's voor zijn fotogalerij.,Argument Structure,argument_number_(in)transitive,1219,zijn foto's,bewerkt
Tessa ontwikkelt geduldig haar vaardigheden op de piano.,Tessa springt geduldig haar vaardigheden op de piano.,Argument Structure,argument_number_(in)transitive,1220,haar vaardigheden,ontwikkelt
Umar repareert onmiddellijk elke kapotte lamp in huis.,Umar slaapt onmiddellijk elke kapotte lamp in huis.,Argument Structure,argument_number_(in)transitive,1221,elke kapotte lamp,repareert
Valerie fotografeert graag mooie zonsondergangen aan het strand.,Valerie berekent graag mooie zonsondergangen aan het strand.,Argument Structure,argument_number_(in)transitive,1222,mooie zonsondergangen,fotografeert
Wouter promoot regelmatig lokale kunstenaars op sociale media.,Wouter gokt regelmatig lokale kunstenaars op sociale media.,Argument Structure,argument_number_(in)transitive,1223,lokale kunstenaars,promoot
Xenia schrijft elke dag een verhaal voor het slapengaan.,Xenia jaagt elke dag een verhaal voor het slapengaan.,Argument Structure,argument_number_(in)transitive,1224,een verhaal,schrijft
Yannick herstelt snel alle technische problemen op kantoor.,Yannick huilt snel alle technische problemen op kantoor.,Argument Structure,argument_number_(in)transitive,1225,alle technische problemen,herstelt
Zoë organiseert periodiek evenementen voor haar vriendengroep.,Zoë kwebbelt periodiek evenementen voor haar vriendengroep.,Argument Structure,argument_number_(in)transitive,1226,evenementen,organiseert
Victor beheert zorgvuldig zijn financiën elke maand.,Victor sluimert zorgvuldig zijn financiën elke maand.,Argument Structure,argument_number_(in)transitive,1227,zijn financiën,beheert
Sylvia beoefent dagelijks een sport voor haar gezondheid.,Sylvia lubbert dagelijks een sport voor haar gezondheid.,Argument Structure,argument_number_(in)transitive,1228,een sport,beoefent
Ruben ontwerpt wekelijks nieuwe logo's voor zijn klanten.,Ruben oogt wekelijks nieuwe logo's voor zijn klanten.,Argument Structure,argument_number_(in)transitive,1229,nieuwe logo's,ontwerpt
Yasmin leert elke maand een nieuwe taal via online cursussen.,Yasmin gaapt elke maand een nieuwe taal via online cursussen.,Argument Structure,argument_number_(in)transitive,1230,een nieuwe taal,leert
Finn maakt regelmatig lange wandelingen in de natuur.,Finn radicaliseert regelmatig lange wandelingen in de natuur.,Argument Structure,argument_number_(in)transitive,1231,lange wandelingen,maakt
Gaby plant jaarlijks een reis naar een exotische bestemming.,Gaby rekt jaarlijks een reis naar een exotische bestemming.,Argument Structure,argument_number_(in)transitive,1232,een reis,plant
Maud ontwerpt regelmatig nieuwe kledingstukken voor haar collectie.,Maud mazzelt regelmatig nieuwe kledingstukken voor haar collectie.,Argument Structure,argument_number_(in)transitive,1233,nieuwe kledingstukken,ontwerpt
Raf speelt dagelijks muziek op zijn gitaar.,Raf schilfert dagelijks muziek op zijn gitaar.,Argument Structure,argument_number_(in)transitive,1234,muziek,speelt
Ulla schildert regelmatig portretten van haar vrienden.,Ulla smaakt regelmatig portretten van haar vrienden.,Argument Structure,argument_number_(in)transitive,1235,portretten,schildert
Alice brengt jaarlijks een bezoek aan haar familie in het buitenland.,Alice zakt jaarlijks een bezoek aan haar familie in het buitenland.,Argument Structure,argument_number_(in)transitive,1236,een bezoek,brengt
Juliette bezoekt elk jaar historische locaties voor haar interesse in geschiedenis.,Juliette krimpt elk jaar historische locaties voor haar interesse in geschiedenis.,Argument Structure,argument_number_(in)transitive,1237,historische locaties,bezoekt
Bella ontwerpt elk seizoen haar eigen kledinglijn.,Bella danst elk seizoen haar eigen kledinglijn.,Argument Structure,argument_number_(in)transitive,1238,haar eigen kledinglijn,ontwerpt
Casper bestuurt maandelijks zijn drone in het park.,Casper slaapt maandelijks zijn drone in het park.,Argument Structure,argument_number_(in)transitive,1239,zijn drone,bestuurt
Daphne organiseert jaarlijks haar verjaardagsfeest thuis.,Daphne slaapt jaarlijks haar verjaardagsfeest thuis.,Argument Structure,argument_number_(in)transitive,1240,haar verjaardagsfeest,organiseert
Femke schildert periodiek haar slaapkamer in nieuwe kleuren.,Femke valt periodiek haar slaapkamer in nieuwe kleuren.,Argument Structure,argument_number_(in)transitive,1241,haar slaapkamer,schildert
Jasmijn traint dagelijks haar hond in het gehoorzaam zijn.,Jasmijn zwemt dagelijks haar hond in het gehoorzaam zijn.,Argument Structure,argument_number_(in)transitive,1242,haar hond,traint
Koen verzorgt elk weekend zijn planten met extra water.,Koen huilt elk weekend zijn planten met extra water.,Argument Structure,argument_number_(in)transitive,1243,zijn planten,verzorgt
Nadia promoot periodiek haar kunstwerken op sociale media.,Nadia gokt periodiek haar kunstwerken op sociale media.,Argument Structure,argument_number_(in)transitive,1244,haar kunstwerken,promoot
Pien herstelt snel alle gebroken voorwerpen in huis.,Pien kijkt snel alle gebroken voorwerpen in huis.,Argument Structure,argument_number_(in)transitive,1245,alle gebroken voorwerpen,herstelt
Quinten ontwikkelt regelmatig zijn fotografievaardigheden.,Quinten valt regelmatig zijn fotografievaardigheden.,Argument Structure,argument_number_(in)transitive,1246,zijn fotografievaardigheden,ontwikkelt
Valerie test regelmatig haar zelfgeschreven computerprogramma's.,Valerie reageert regelmatig haar zelfgeschreven computerprogramma's.,Argument Structure,argument_number_(in)transitive,1247,haar zelfgeschreven computerprogramma's,test
Elif beantwoordt dagelijks haar telefoon met een vriendelijke stem.,Elif tennist dagelijks haar telefoon met een vriendelijke stem.,Argument Structure,argument_number_(in)transitive,1248,haar telefoon,beantwoordt
Julian plaatst regelmatig nieuwe meubels in zijn appartement.,Julian groeit regelmatig nieuwe meubels in zijn appartement.,Argument Structure,argument_number_(in)transitive,1249,nieuwe meubels,plaatst
Marijn verschafte maandelijks informatie aan zijn teamleden.,Marijn klom maandelijks informatie aan zijn teamleden.,Argument Structure,argument_number_(in)transitive,1250,informatie,verschafte
Eline begeleidt wekelijks haar vrienden bij het leren van nieuwe vaardigheden.,Eline zit wekelijks haar vrienden bij het leren van nieuwe vaardigheden.,Argument Structure,argument_number_(in)transitive,1251,haar vrienden,begeleidt
Daan distribueert periodiek flyers voor lokale evenementen.,Daan blaft periodiek flyers voor lokale evenementen.,Argument Structure,argument_number_(in)transitive,1252,flyers,distribueert
Lisa regelt elke week haar afspraken met klanten.,Lisa glimlacht maandelijks haar afspraken met klanten.,Argument Structure,argument_number_(in)transitive,1253,haar afspraken,regelt
Timo presenteert maandelijks zijn projectresultaten aan het management.,Timo verdwaalt maandelijks zijn projectresultaten aan het management.,Argument Structure,argument_number_(in)transitive,1254,zijn projectresultaten,presenteert
Emma biedt dagelijks hulp aan ouderen in haar buurt.,Emma krimpt dagelijks hulp aan ouderen in haar buurt.,Argument Structure,argument_number_(in)transitive,1255,hulp,biedt
Lucas faciliteert regelmatig workshops over duurzaamheid.,Lucas veroudert regelmatig workshops over duurzaamheid.,Argument Structure,argument_number_(in)transitive,1256,workshops,faciliteert
Julia legt jaarlijks bloemen op het graf van haar grootouders.,Julia zwaait jaarlijks bloemen op het graf van haar grootouders.,Argument Structure,argument_number_(in)transitive,1257,bloemen,legt
Thijs verstrekt regelmatig advies aan zijn collega's.,Thijs zweeft regelmatig advies aan zijn collega's.,Argument Structure,argument_number_(in)transitive,1258,advies,verstrekt
Eva deelt iedere maand haar ervaringen met haar vrienden.,Eva wendt iedere maand haar ervaringen met haar vrienden.,Argument Structure,argument_number_(in)transitive,1259,haar ervaringen,deelt
Timo ruikt dagelijks bloemen in de tuin.,Timo huppelt dagelijks bloemen in de tuin.,Argument Structure,argument_number_(in)transitive,1260,bloemen,ruikt
Milan vangt altijd de bal tijdens het voetballen.,Milan slaapt altijd de bal tijdens het voetballen.,Argument Structure,argument_number_(in)transitive,1261,de bal,vangt
Sven componeert dit jaar een melodie voor het nieuwe lied.,Sven stuitert dit jaar een melodie voor het nieuwe lied.,Argument Structure,argument_number_(in)transitive,1262,een melodie,componeert
Desiree regisseert een kortfilm voor het lokale filmfestival.,Desiree verdwaalt een kortfilm voor het lokale filmfestival.,Argument Structure,argument_number_(in)transitive,1263,een kortfilm,regisseert
Simon ziet een prachtige zonsondergang vanaf mijn balkon.,Simon kijkt een prachtige zonsondergang vanaf mijn balkon.,Argument Structure,argument_number_(in)transitive,1264,een prachtige zonsondergang,ziet
Gijs hoort de melodieën die de muzikant speelt.,Gijs luistert de melodieën die de muzikant speelt.,Argument Structure,argument_number_(in)transitive,1265,de melodieën,hoort
Mirjam voelt de textuur van het zachte dekbed op haar huid.,Mirjam kruipt de textuur van het zachte dekbed op haar huid.,Argument Structure,argument_number_(in)transitive,1266,de textuur,voelt
Erik proeft de nieuwe smaken in dit exotische gerecht.,Erik schreeuwt de nieuwe smaken in dit exotische gerecht.,Argument Structure,argument_number_(in)transitive,1267,de nieuwe smaken,proeft
Bas ruikt de heerlijke geur van versgebakken broodjes.,Bas vaart de heerlijke geur van versgebakken broodjes.,Argument Structure,argument_number_(in)transitive,1268,de heerlijke geur,ruikt
Elsa grijpt de kans om haar dromen na te jagen.,Elsa droomt de kans om haar dromen na te jagen.,Argument Structure,argument_number_(in)transitive,1269,de kans,grijpt
Wilma pakt altijd de sleutels voordat ze de deur uitgaat.,Wilma ontwaakt altijd de sleutels voordat ze de deur uitgaat.,Argument Structure,argument_number_(in)transitive,1270,de sleutels,pakt
Sara duwt elke morgen de deur zachtjes open om niemand te storen.,Sara gaapt elke morgen de deur zachtjes open om niemand te storen.,Argument Structure,argument_number_(in)transitive,1271,de deur,duwt
Marcel trekt voorzichtig de gordijnen dicht voor privacy.,Marcel roeit voorzichtig de gordijnen dicht voor privacy.,Argument Structure,argument_number_(in)transitive,1272,de gordijnen,trekt
Isabel tilt vanavond dit zware meubelstuk op.,Isabel rijdt vanavond dit zware meubelstuk op.,Argument Structure,argument_number_(in)transitive,1273,dit zware meubelstuk,tilt
Damian vindt gemakkelijk de oplossing voor dit raadsel.,Damian draait gemakkelijk de oplossing voor dit raadsel.,Argument Structure,argument_number_(in)transitive,1274,de oplossing,vindt
Zara ontdekt steeds nieuwe mogelijkheden en uitdagingen.,Zara verdwijnt steeds nieuwe mogelijkheden en uitdagingen.,Argument Structure,argument_number_(in)transitive,1275,nieuwe mogelijkheden,ontdekt
Kees verbergt ergens een cadeau voor de verrassing.,Kees ontsnapt ergens een cadeau voor de verrassing.,Argument Structure,argument_number_(in)transitive,1276,een cadeau,verbergt
Marianne demonstreert graag dit apparaat aan het publiek.,Marianne verzwakt graag dit apparaat aan het publiek.,Argument Structure,argument_number_(in)transitive,1277,dit apparaat,demonstreert
Clara illustreert dit verhaal met prachtige tekeningen.,Clara stijgt dit verhaal met prachtige tekeningen.,Argument Structure,argument_number_(in)transitive,1278,dit verhaal,illustreert
Dario begrijpt gelukkig de moeilijke concepten na de uitleg.,Dario glijdt gelukkig de moeilijke concepten na de uitleg.,Argument Structure,argument_number_(in)transitive,1279,de moeilijke concepten,begrijpt
Stephanie onderwijst studenten met passie.,Stephanie rust studenten met passie.,Argument Structure,argument_number_(in)transitive,1280,studenten,onderwijst
Amanda creëert altijd een fijne sfeer in haar huis.,Amanda buigt altijd een fijne sfeer in haar huis.,Argument Structure,argument_number_(in)transitive,1281,een fijne sfeer,creëert
Berend ontwerpt volgende week een logo voor het bedrijf.,Berend herleeft volgende week een logo voor het bedrijf.,Argument Structure,argument_number_(in)transitive,1282,een logo,ontwerpt
Tina bouwt een stevige basis voor het nieuwe gebouw.,Tina bezinkt een stevige basis voor het nieuwe gebouw.,Argument Structure,argument_number_(in)transitive,1283,een stevige basis,bouwt
Ursula verbouwt de keuken voor meer werkruimte.,Ursula ontspant de keuken voor meer werkruimte.,Argument Structure,argument_number_(in)transitive,1284,de keuken,verbouwt
Sebastiaan onderhoudt regelmatig zijn auto voor optimale prestaties,Sebastiaan verdwaalt regelmatig zijn auto voor optimale prestaties,Argument Structure,argument_number_(in)transitive,1285,zijn auto,onderhoudt
Dominique installeert de software op haar computer.,Dominique buigt de software op haar computer.,Argument Structure,argument_number_(in)transitive,1286,de software,installeert
Fiona monteert de meubels volgens de bijgeleverde instructies.,Fiona verdort de meubels volgens de bijgeleverde instructies.,Argument Structure,argument_number_(in)transitive,1287,de meubels,monteert
Gerard speelt elke avond muziek om je stemming te verbeteren.,Gerard ontploft elke avond muziek om je stemming te verbeteren.,Argument Structure,argument_number_(in)transitive,1288,muziek,speelt
Irene tekent de komende maanden een plattegrond van het gebouw.,Irene neuriet de komende maanden een plattegrond van het gebouw.,Argument Structure,argument_number_(in)transitive,1289,een plattegrond,tekent
Richard produceert hoogwaardige producten voor onze klanten.,Richard snurkt hoogwaardige producten voor onze klanten.,Argument Structure,argument_number_(in)transitive,1290,hoogwaardige producten,produceert
Thomas gaf de hond een bot voor zijn verjaardag.,Thomas doneerde de hond een bot voor zijn verjaardag.,Argument Structure,argument_number_ditransitive,51,een bot,gaf
Sophie belooft Lucas een beloning voor deze opdracht.,Sophie gelooft Lucas een beloning voor deze opdracht.,Argument Structure,argument_number_ditransitive,52,een beloning,belooft
Lisa schonk de kat een halsband met echte diamantjes.,Lisa kocht de kat een halsband met echte diamantjes.,Argument Structure,argument_number_ditransitive,53,een halsband,schonk
Noah stuurt de schoonmaakster een kaart vanaf zijn vakantiebestemming.,Noah verstuurt de schoonmaakster een kaart vanaf zijn vakantiebestemming.,Argument Structure,argument_number_ditransitive,54,een kaart,stuurt
Finn verhuurde Sarah een auto tijdens de vakantie.,Finn huurde Sarah een auto tijdens de vakantie.,Argument Structure,argument_number_ditransitive,55,een auto,verhuurde
Mila ontnam Lars de motor in de echtscheiding.,Mila beroofde Lars de motor in de echtscheiding.,Argument Structure,argument_number_ditransitive,56,de motor,ontnam
Sam biedt Olivia de schoenen aan in de uitverkoop.,Sam drijft Olivia de schoenen aan in de uitverkoop.,Argument Structure,argument_number_ditransitive,57,de schoenen,biedt
Tim zond Max een bloemetje na het ongeluk.,Tim begreep Max een bloemetje na het ongeluk.,Argument Structure,argument_number_ditransitive,58,een bloemetje,zond
Zoë biechtte Nora de diefstal op in het verhoor.,Zoë zocht Nora de diefstal op in het verhoor.,Argument Structure,argument_number_ditransitive,59,de diefstal,biechtte
David verkoopt de vrouw een jurk voor haar bruiloft.,David verhandelt de vrouw een jurk voor haar bruiloft.,Argument Structure,argument_number_ditransitive,60,een jurk,verkoopt
Emma overhandigde haar zus een zelfgebakken taart voor haar verjaardag.,Emma overlegde haar zus een zelfgebakken taart voor haar verjaardag.,Argument Structure,argument_number_ditransitive,1291,een zelfgebakken taart,overhandigde
De leraar gaf de studenten extra oefeningen voor het examen.,De leraar beval de studenten extra oefeningen voor het examen.,Argument Structure,argument_number_ditransitive,1292,extra oefeningen,gaf
Isabel schonk haar vriend een zelfgemaakte sjaal voor de winter.,Isabel bestelde haar vriend een zelfgemaakte sjaal voor de winter.,Argument Structure,argument_number_ditransitive,1293,een zelfgemaakte sjaal,schonk
Simon stuurde zijn moeder een ansichtkaart tijdens zijn reis.,Simon begreep zijn moeder een ansichtkaart tijdens zijn reis.,Argument Structure,argument_number_ditransitive,1294,een ansichtkaart,stuurde
De chef bood de medewerkers een bonus aan voor hun harde werk.,De chef beoordeelde de medewerkers een bonus voor hun harde werk.,Argument Structure,argument_number_ditransitive,1295,een bonus,bood
De organisator beloofde de vrijwilligers een bedankfeest na het evenement.,De organisator beweerde de vrijwilligers een bedankfeest na het evenement.,Argument Structure,argument_number_ditransitive,1296,een bedankfeest,beloofde
De dokter schreef de patiënt medicijnen voor zijn herstel voor.,De dokter analyseerde de patiënt medicijnen voor zijn herstel voor.,Argument Structure,argument_number_ditransitive,1297,medicijnen,schreef
De ober bracht de gasten een gratis aperitief voor het diner.,De ober berispte de gasten een gratis aperitief voor het diner.,Argument Structure,argument_number_ditransitive,1298,een gratis aperitief,bracht
De bakker verkocht de klanten een versgebakken brood voor het ontbijt.,De bakker benoemde de klanten een versgebakken brood voor het ontbijt.,Argument Structure,argument_number_ditransitive,1299,een versgebakken brood,verkocht
De chef deelde de medewerkers een compliment uit voor hun prestaties.,De chef dirigeerde de medewerkers een compliment uit voor hun prestaties.,Argument Structure,argument_number_ditransitive,1300,een compliment,deelde
De vader beloofde zijn dochter een verrassing voor haar goede rapport.,De vader beval zijn dochter een verrassing voor haar goede rapport.,Argument Structure,argument_number_ditransitive,1301,een verrassing,beloofde
De leraar wees de studenten een speciale opdracht toe voor het project.,De leraar beschouwde de studenten een speciale opdracht toe voor het project.,Argument Structure,argument_number_ditransitive,1302,een speciale opdracht,wees
Simon bezorgde zijn zus een bloemetje voor haar verjaardag.,Simon bewonderde zijn zus een bloemetje voor haar verjaardag.,Argument Structure,argument_number_ditransitive,1303,een bloemetje,bezorgde
De chef serveerde de gasten een delicatesse voor het hoofdgerecht.,De chef bekeek de gasten een delicatesse voor het hoofdgerecht.,Argument Structure,argument_number_ditransitive,1304,een delicatesse,serveerde
De chef ontzegde de gasten een delicatesse voor het hoofdgerecht.,De chef observeerde de gasten een delicatesse voor het hoofdgerecht.,Argument Structure,argument_number_ditransitive,1305,een delicatesse,ontzegde
Laura leende haar vriendin een boek uit voor de vakantie.,Laura analyseerde haar vriendin een boek uit voor de vakantie.,Argument Structure,argument_number_ditransitive,1306,een boek,leende
Lisa bood haar vriend een helpende hand aan bij het verhuizen.,Lisa beoordeelde haar vriend een helpende hand aan bij het verhuizen.,Argument Structure,argument_number_ditransitive,1307,een helpende hand,bood
De gids wees de toeristen een interessante route aan door de stad.,De gids beschreef de toeristen een interessante route aan door de stad.,Argument Structure,argument_number_ditransitive,1308,een interessante route,wees
De leraar stelde de studenten een vraag voor het proefwerk.,De leraar prees de studenten een vraag voor het proefwerk.,Argument Structure,argument_number_ditransitive,1309,een vraag,stelde
De chef bracht de keukenhulp een nieuw recept voor het dessert.,De chef bestrafte de keukenhulp een nieuw recept voor het dessert.,Argument Structure,argument_number_ditransitive,1310,een nieuw recept,bracht
De zusjes deden hun broer een suggestie voor zijn sollicitatiegesprek.,De zusjes beoordeelden hun broer een suggestie voor zijn sollicitatiegesprek.,Argument Structure,argument_number_ditransitive,1311,een suggestie,deden
De buurman leende de buurvrouw een hamer voor haar klus.,De buurman bekeek de buurvrouw een hamer voor haar klus.,Argument Structure,argument_number_ditransitive,1312,een hamer,leende
