sentence_good,sentence_bad,linguistic_phenomenon,paradigm,item_id,critical_word,cue_word
Het besef van de ernst is de leerlingen snel ontvallen.,Het besef van de ernst heeft de leerlingen snel ontvallen,Argument Structure,ditransitive_nomdat_1,1713,ontvallen,is
De zorgen zijn de ouders niet ontgaan tijdens de reis.,De zorgen hebben de ouders niet ontgaan tijdens de reis.,Argument Structure,ditransitive_nomdat_1,1714,ontgaan,zijn
De mogelijkheden zijn ons niet tegengevallen in het nieuwe project.,De mogelijkheden hebben ons niet tegengevallen in het nieuwe project.,Argument Structure,ditransitive_nomdat_1,1715,tegengevallen,zijn
De trucjes zijn de jongleur goed afgegaan tijdens het optreden.,De trucjes hebben de jongleur goed afgegaan tijdens het optreden.,Argument Structure,ditransitive_nomdat_1,1716,afgegaan,zijn
De inspiratie is de schrijver niet ontvallen tijdens het schrijven.,De inspiratie heeft de schrijver niet ontvallen tijdens het schrijven.,Argument Structure,ditransitive_nomdat_1,1717,ontvallen,is
Het geheim is ons allemaal ontgaan tijdens de verrassingsparty.,Het geheim heeft ons allemaal ontgaan tijdens de verrassingsparty.,Argument Structure,ditransitive_nomdat_1,1718,ontgaan,is
De betekenis van de woorden is me ontschoten na het lange lezen.,De betekenis van de woorden heeft me ontschoten na het lange lezen.,Argument Structure,ditransitive_nomdat_1,1719,ontschoten,is
De kwaliteit van de foto's is ons direct opgevallen.,De kwaliteit van de foto's heeft ons direct opgevallen.,Argument Structure,ditransitive_nomdat_1,1720,opgevallen,is
De oplossing is haar uiteindelijk te binnen geschoten.,De oplossing heeft haar uiteindelijk te binnen geschoten.,Argument Structure,ditransitive_nomdat_1,1721,geschoten,is
Het drama is de actrice zwaar gevallen na de intense scène.,Het drama heeft de actrice zwaar gevallen na de intense scène.,Argument Structure,ditransitive_nomdat_1,1722,gevallen,is
De geur van versgebakken brood is ons altijd opgevallen in de bakkerij.,De geur van versgebakken brood heeft ons altijd opgevallen in de bakkerij.,Argument Structure,ditransitive_nomdat_1,1723,opgevallen,is
De regen is ons plotseling tegengevallen tijdens de wandeling.,De regen heeft ons plotseling tegengevallen tijdens de wandeling.,Argument Structure,ditransitive_nomdat_1,1724,tegengevallen,is
Het mysterie is ons allemaal ontgaan tijdens het raadselachtige verhaal.,Het mysterie heeft ons allemaal ontgaan tijdens het raadselachtige verhaal.,Argument Structure,ditransitive_nomdat_1,1725,ontgaan,is
Het succes is de atleet snel overkomen na hard trainen.,Het succes heeft de atleet snel overkomen na hard trainen.,Argument Structure,ditransitive_nomdat_1,1726,overkomen,is
De woorden zijn haar ontschoten tijdens de presentatie.,De woorden hebben haar ontschoten tijdens de presentatie.,Argument Structure,ditransitive_nomdat_1,1727,ontschoten,zijn
De obstakels zijn de renner niet ontgaan tijdens het parcours.,De obstakels hebben de renner niet ontgaan tijdens het parcours.,Argument Structure,ditransitive_nomdat_1,1728,ontgaan,zijn
De geur van bloemen is ons altijd opgevallen in de tuin.,De geur van bloemen heeft ons altijd opgevallen in de tuin.,Argument Structure,ditransitive_nomdat_1,1729,opgevallen,van
Het probleem is ons allemaal ontgaan tijdens de vergadering.,Het probleem heeft ons allemaal ontgaan tijdens de vergadering.,Argument Structure,ditransitive_nomdat_1,1730,ontgaan,is
De puzzel is de kinderen snel gelukt tijdens de regenachtige middag.,De puzzel heeft de kinderen snel gelukt tijdens de regenachtige middag.,Argument Structure,ditransitive_nomdat_1,1731,gelukt,is
Het nieuws is Mia onverwacht tegengevallen na het telefoontje.,Het nieuws heeft Mia onverwacht tegengevallen na het telefoontje.,Argument Structure,ditransitive_nomdat_1,1732,tegengevallen,is
De verbeteringen zijn de leraar positief opgevallen na het examen.,De verbeteringen hebben de leraar positief opgevallen na het examen.,Argument Structure,ditransitive_nomdat_1,1733,opgevallen,zijn
De ontwikkelingen zijn de wetenschappers niet ontgaan tijdens het experiment.,De ontwikkelingen hebben de wetenschappers niet ontgaan tijdens het experiment.,Argument Structure,ditransitive_nomdat_1,1734,ontgaan,zijn
Het plot van de film is ons snel duidelijk geworden.,Het plot van de film heeft ons snel duidelijk geworden.,Argument Structure,ditransitive_nomdat_1,1735,geworden,is
De kennis is de studenten goed bijgebleven na de cursus.,De kennis heeft de studenten goed bijgebleven na de cursus.,Argument Structure,ditransitive_nomdat_1,1736,bijgebleven,is
De fouten in de tekst zijn de editor snel opgevallen tijdens het nakijken.,De fouten in de tekst hebben de editor snel opgevallen tijdens het nakijken.,Argument Structure,ditransitive_nomdat_1,1737,opgevallen,zijn
De verhalen zijn de kinderen snel duidelijk geworden tijdens het voorlezen.,De verhalen hebben de kinderen snel duidelijk geworden tijdens het voorlezen.,Argument Structure,ditransitive_nomdat_1,1738,geworden,zijn
De wendingen in het verhaal zijn ons geleidelijk duidelijk geworden.,De wendingen in het verhaal hebben ons geleidelijk duidelijk geworden.,Argument Structure,ditransitive_nomdat_1,1739,geworden,zijn
De aanwijzingen zijn de speurders snel opgevallen tijdens het onderzoek.,De aanwijzingen zijn de speurders snel opgevallen tijdens het onderzoek.,Argument Structure,ditransitive_nomdat_1,1740,opgevallen,zijn
De uitspraken hebben Mike heel erg tegengestaan tijdens de scheiding. ,De uitspraken zijn Mike heel erg tegengestaan tijdens de scheiding.,Argument Structure,ditransitive_nomdat_2,101,tegengestaan,hebben
De vrienden hebben Niels eigenlijk altijd bijgestaan in moeilijke situaties.,De vrienden zijn Niels eigenlijk altijd bijgestaan in moeilijke situaties.,Argument Structure,ditransitive_nomdat_2,102,bijgestaan,hebben
De oefeningen hebben Petra altijd goed gelegen in de sportschool.,De oefeningen zijn Petra altijd goed gelegen in de sportschool.,Argument Structure,ditransitive_nomdat_2,103,gelegen,hebben
De kledingstukken hebben Maria niet meer gepast na haar dieet. ,De kledingstukken zijn Maria niet meer gepast na haar dieet. ,Argument Structure,ditransitive_nomdat_2,104,gepast,hebben
Het diner heeft Owen heel goed gesmaakt in dat restaurant.,Het diner is Owen heel goed gesmaakt in dat restaurant.,Argument Structure,ditransitive_nomdat_2,105,gesmaakt,heeft
De reis heeft Pieter nogal wat tegengezeten de afgelopen dagen.,De reis is Pieter nogal wat tegengezeten de afgelopen dagen.,Argument Structure,ditransitive_nomdat_2,106,tegengezeten,heeft
De vriendengroep heeft Ryan eens goed aangesproken op zijn gedrag.,De vriendengroep is Ryan eens goed aangesproken op zijn gedrag.,Argument Structure,ditransitive_nomdat_2,107,aangesproken,heeft
Het buffet heeft Tessa zeer zeker voldaan iedere avond weer.,Het buffet is Tessa zeer zeker voldaan iedere avond weer.,Argument Structure,ditransitive_nomdat_2,108,voldaan,heeft
De docenten hebben Romy even streng aangesproken over haar huiswerk.,De docenten zijn Romy even streng aangesproken over haar huiswerk.,Argument Structure,ditransitive_nomdat_2,109,aangesproken,hebben
Dit vak heeft Sanne altijd goed gelegen op de basisschool.,Dit vak is Sanne altijd goed gelegen op de basisschool.,Argument Structure,ditransitive_nomdat_2,110,gelegen,heeft
De opdrachten hebben Laura altijd geïnspireerd tijdens de cursus.,De opdrachten zijn Laura altijd geïnspireerd tijdens de cursus.,Argument Structure,ditransitive_nomdat_2,1741,geïnspireerd,hebben
De feedback heeft David enorm geholpen bij zijn scriptie.,De feedback is David enorm geholpen bij zijn scriptie.,Argument Structure,ditransitive_nomdat_2,1742,geholpen,heeft
De geheimen hebben Emma vaak verbaasd in de vriendengroep.,De geheimen zijn Emma vaak verbaasd in de vriendengroep.,Argument Structure,ditransitive_nomdat_2,1743,verbaasd,hebben
De uitdagingen hebben Tim aangemoedigd om te groeien als persoon.,De uitdagingen zijn Tim aangemoedigd om te groeien als persoon.,Argument Structure,ditransitive_nomdat_2,1744,aangemoedigd,hebben
De taak heeft Lisa wat moeite gekost om te volbrengen.,De taak is Lisa wat moeite gekost om te volbrengen.,Argument Structure,ditransitive_nomdat_2,1745,moeite gekost,heeft
De grap heeft Jasper echt doen lachen tijdens de voorstelling.,De grap is Jasper echt doen lachen tijdens de voorstelling.,Argument Structure,ditransitive_nomdat_2,1746,doen lachen,heeft
De problemen hebben Sophie soms wat overweldigd in haar werk.,De problemen zijn Sophie soms wat overweldigd in haar werk.,Argument Structure,ditransitive_nomdat_2,1747,overweldigd,hebben
De nieuwe regels hebben de werknemers in het bedrijf verbaasd.,De nieuwe regels zijn de werknemers in het bedrijf verbaasd.,Argument Structure,ditransitive_nomdat_2,1748,verbaasd,hebbem
De veranderingen hebben Marcel gesterkt in zijn besluit.,De veranderingen zijn Marcel gesterkt in zijn besluit.,Argument Structure,ditransitive_nomdat_2,1749,gesterkt,hebben
Het voorstel heeft de teamleden wat verward in het begin.,Het voorstel is de teamleden wat verward in het begin.,Argument Structure,ditransitive_nomdat_2,1750,verward,heeft
De trucjes hebben de kinderen altijd gefascineerd tijdens de goochelshow.,De trucjes zijn de kinderen altijd gefascineerd tijdens de goochelshow.,Argument Structure,ditransitive_nomdat_2,1751,gefascineerd,hebben
De lessen hebben Michelle geholpen haar vaardigheden te verbeteren.,De lessen zijn Michelle geholpen haar vaardigheden te verbeteren.,Argument Structure,ditransitive_nomdat_2,1752,geholpen,hebben
De regels hebben Jonas beperkt in zijn creativiteit.,De regels zijn Jonas beperkt in zijn creativiteit.,Argument Structure,ditransitive_nomdat_2,1753,beperkt,hebben
De oplossingen hebben de situatie verbeterd.,De oplossingen zijn de situatie verbeterd.,Argument Structure,ditransitive_nomdat_2,1754,verbeterd,hebben
De resultaten hebben de wetenschappers verrast.,De resultaten zijn de wetenschappers verrast.,Argument Structure,ditransitive_nomdat_2,1755,verrast,hebben
De vragen hebben de studenten aan het denken gezet.,De vragen zijn de studenten aan het denken gezet.,Argument Structure,ditransitive_nomdat_2,1756,aan het denken gezet,hebben
De methoden hebben de onderzoekers geholpen nieuwe inzichten te verkrijgen.,De methoden zijn de onderzoekers geholpen nieuwe inzichten te verkrijgen.,Argument Structure,ditransitive_nomdat_2,1757,geholpen,hebben
De opmerkingen hebben de schrijver geïnspireerd om verder te gaan.,De opmerkingen zijn de schrijver geïnspireerd om verder te gaan.,Argument Structure,ditransitive_nomdat_2,1758,geïnspireerd,hebben
De prestaties hebben het publiek verbaasd tijdens de show.,De prestaties zijn het publiek verbaasd tijdens de show.,Argument Structure,ditransitive_nomdat_2,1759,verbaasd,hebben
De gebeurtenissen hebben Lisa diep geraakt.,De gebeurtenissen zijn Lisa diep geraakt.,Argument Structure,ditransitive_nomdat_2,1760,geraakt,hebben
De uitkomst heeft de wiskundige verrast.,De uitkomst is de wiskundige verrast.,Argument Structure,ditransitive_nomdat_2,1761,verrast,heeft
De opdracht heeft de studenten uitgedaagd.,De opdracht is de studenten uitgedaagd.,Argument Structure,ditransitive_nomdat_2,1762,uitgedaagd,heeft
De uitvindingen hebben de wetenschappers wereldwijd beïnvloed.,De uitvindingen zijn de wetenschappers wereldwijd beïnvloed.,Argument Structure,ditransitive_nomdat_2,1763,beïnvloed,hebben
De berichten hebben de lezer aan het denken gezet.,De berichten zijn de lezer aan het denken gezet.,Argument Structure,ditransitive_nomdat_2,1764,aan het denken gezet,hebben
De prenten hebben de kinderen geamuseerd.,De prenten zijn de kinderen geamuseerd.,Argument Structure,ditransitive_nomdat_2,1765,geamuseerd,hebben
De conclusies hebben de onderzoekers geholpen bij hun werk.,De conclusies zijn de onderzoekers geholpen bij hun werk.,Argument Structure,ditransitive_nomdat_2,1766,geholpen,hebben
De oplossingen hebben de problemen opgelost.,De oplossingen zijn de problemen opgelost.,Argument Structure,ditransitive_nomdat_2,1767,opgelost,hebben
De ontwikkelingen hebben de industrie veranderd.,De ontwikkelingen zijn de industrie veranderd.,Argument Structure,ditransitive_nomdat_2,1768,veranderd,hebben
De discussies hebben de teamleden dichter bij elkaar gebracht.,De discussies zijn de teamleden dichter bij elkaar gebracht.,Argument Structure,ditransitive_nomdat_2,1769,bij elkaar gebracht,hebben
De veranderingen hebben het landschap getransformeerd.,De veranderingen zijn het landschap getransformeerd.,Argument Structure,ditransitive_nomdat_2,1770,getransformeerd,hebben
De gevolgen hebben de beslissing beïnvloed.,De gevolgen zijn de beslissing beïnvloed.,Argument Structure,ditransitive_nomdat_2,1771,beïnvloed,hebben
De gesprekken hebben de misverstanden opgehelderd.,De gesprekken zijn de misverstanden opgehelderd.,Argument Structure,ditransitive_nomdat_2,1772,opgehelderd,hebben
De opmerkingen hebben de presentatie verbeterd.,De opmerkingen zijn de presentatie verbeterd.,Argument Structure,ditransitive_nomdat_2,1773,verbeterd,hebben
De uitkomst heeft de onderhandelingen positief beïnvloed.,De uitkomst is de onderhandelingen positief beïnvloed.,Argument Structure,ditransitive_nomdat_2,1774,beïnvloed,heeft
De beslissingen hebben de koers van het bedrijf veranderd.,De beslissingen zijn de koers van het bedrijf veranderd.,Argument Structure,ditransitive_nomdat_2,1775,veranderd,hebben
De problemen hebben de ingenieur uitgedaagd.,De problemen zijn de ingenieur uitgedaagd.,Argument Structure,ditransitive_nomdat_2,1776,uitgedaagd,hebben
De gebeurtenissen hebben de hoofdpersoon gevormd.,De gebeurtenissen zijn de hoofdpersoon gevormd.,Argument Structure,ditransitive_nomdat_2,1777,gevormd,hebben
De verhalen hebben de lezers geboeid.,De verhalen zijn de lezers geboeid.,Argument Structure,ditransitive_nomdat_2,1778,geboeid,hebben
De discussies hebben de meningen gevormd.,De discussies zijn de meningen gevormd.,Argument Structure,ditransitive_nomdat_2,1779,gevormd,hebben
De discussies hebben de studenten kritisch leren denken.,De discussies zijn de studenten kritisch leren denken.,Argument Structure,ditransitive_nomdat_2,1780,leren denken,hebben
De opdrachten hebben de studenten voorbereid op de toets.,De opdrachten zijn de studenten voorbereid op de toets.,Argument Structure,ditransitive_nomdat_2,1781,voorbereid,hebben
De prestaties hebben het publiek vermaakt.,De prestaties zijn het publiek vermaakt.,Argument Structure,ditransitive_nomdat_2,1782,vermaakt,hebben
De gesprekken hebben de vriendschap verdiept.,De gesprekken zijn de vriendschap verdiept.,Argument Structure,ditransitive_nomdat_2,1783,verdiept,hebben
Mijn ouders hebben me altijd bijgestaan.,Mijn ouders zijn me altijd bijgestaan.,Argument Structure,ditransitive_nomdat_2,1784,bijgestaan,hebben
De ontwikkelingen hebben de sector vernieuwd.,De ontwikkelingen zijn de sector vernieuwd.,Argument Structure,ditransitive_nomdat_2,1785,vernieuwd,hebben
De uitdagingen hebben mijn vaardigheden verbeterd.,De uitdagingen zijn mijn vaardigheden verbeterd.,Argument Structure,ditransitive_nomdat_2,1786,verbeterd,hebben
De inzichten hebben de strategie aangescherpt.,De inzichten zijn de strategie aangescherpt.,Argument Structure,ditransitive_nomdat_2,1787,aangescherpt,hebben
De opmerkingen hebben het essay verduidelijkt.,De opmerkingen zijn het essay verduidelijkt.,Argument Structure,ditransitive_nomdat_2,1788,verduidelijkt,hebben
De moeilijkheden hebben de teamspirit versterkt.,De moeilijkheden zijn de teamspirit versterkt.,Argument Structure,ditransitive_nomdat_2,1789,versterkt,hebben
De presentatie heeft de klanten overtuigd.,De presentatie is de klanten overtuigd.,Argument Structure,ditransitive_nomdat_2,1790,overtuigd,heeft
De berichten hebben de lezers geïnformeerd.,De berichten zijn de lezers geïnformeerd.,Argument Structure,ditransitive_nomdat_2,1791,geïnformeerd,hebben
De beslissingen hebben de organisatie versterkt.,De beslissingen zijn de organisatie versterkt.,Argument Structure,ditransitive_nomdat_2,1792,versterkt,hebben
De uitvindingen hebben de mensheid vooruitgeholpen.,De uitvindingen zijn de mensheid vooruitgeholpen.,Argument Structure,ditransitive_nomdat_2,1793,vooruitgeholpen,hebben
De uitdagingen hebben mijn doorzettingsvermogen getest.,De uitdagingen zijn mijn doorzettingsvermogen getest.,Argument Structure,ditransitive_nomdat_2,1794,getest,hebben
De reacties hebben de spreker geïnspireerd.,De reacties zijn de spreker geïnspireerd.,Argument Structure,ditransitive_nomdat_2,1795,geïnspireerd,hebben
De spelletjes hebben de kinderen geboeid.,De spelletjes zijn de kinderen geboeid,Argument Structure,ditransitive_nomdat_2,1796,geboeid,hebben
De ontdekkingen hebben de wetenschap vooruitgeholpen.,De ontdekkingen zijn de wetenschap vooruitgeholpen.,Argument Structure,ditransitive_nomdat_2,1797,vooruitgeholpen,hebben
De conclusies hebben de onderzoekers geleid.,De conclusies zijn de onderzoekers geleid.,Argument Structure,ditransitive_nomdat_2,1798,geleid,hebben
De veranderingen hebben het landschap verfraaid.,De veranderingen zijn het landschap verfraaid.,Argument Structure,ditransitive_nomdat_2,1799,verfraaid,hebben
De gebeurtenissen hebben mijn perspectief veranderd.,De gebeurtenissen zijn mijn perspectief veranderd.,Argument Structure,ditransitive_nomdat_2,1800,veranderd,hebben
De ervaringen hebben me gevormd als persoon.,De ervaringen zijn me gevormd als persoon.,Argument Structure,ditransitive_nomdat_2,1801,gevormd,hebben
De uitdagingen hebben de studenten gemotiveerd.,De uitdagingen zijn de studenten gemotiveerd.,Argument Structure,ditransitive_nomdat_2,1802,gemotiveerd,hebben
De inzichten hebben de strategie verfijnd.,De inzichten zijn de strategie verfijnd.,Argument Structure,ditransitive_nomdat_2,1803,verfijnd,hebben
De resultaten hebben de doelen bereikt.,De resultaten zijn de doelen bereikt.,Argument Structure,ditransitive_nomdat_2,1804,bereikt,hebben
De opmerkingen hebben de sfeer verbeterd.,De opmerkingen zijn de sfeer verbeterd.,Argument Structure,ditransitive_nomdat_2,1805,verbeterd,hebben
De oefeningen hebben de atleet in topvorm gehouden.,De oefeningen zijn de atleet in topvorm gehouden.,Argument Structure,ditransitive_nomdat_2,1806,gehouden,hebben
De veranderingen hebben het bedrijfsproces vereenvoudigd.,De veranderingen zijn het bedrijfsproces vereenvoudigd.,Argument Structure,ditransitive_nomdat_2,1807,vereenvoudigd,hebben
De ontwikkelingen hebben de sector getransformeerd.,De ontwikkelingen zijn de sector getransformeerd.,Argument Structure,ditransitive_nomdat_2,1808,getransformeerd,hebben
De oplossingen hebben de problemen aangepakt.,De oplossingen zijn de problemen aangepakt.,Argument Structure,ditransitive_nomdat_2,1809,aangepakt,hebben
De aanpak heeft de klant echt aangesproken tijdens de presentatie.,De aanpak is de klant echt aangesproken tijdens de presentatie.,Argument Structure,ditransitive_nomdat_2,1810,aangesproken,heeft
De oplossingen hebben het team geholpen bij het overwinnen van de uitdagingen.,De oplossingen zijn het team geholpen bij het overwinnen van de uitdagingen.,Argument Structure,ditransitive_nomdat_2,1811,geholpen,hebben
De kritiek heeft haar diep geraakt tijdens het interview.,De kritiek is haar diep geraakt tijdens het interview.,Argument Structure,ditransitive_nomdat_2,1812,geraakt,heeft
Het voorstel heeft de directie overtuigd tijdens de vergadering.,Het voorstel is de directie overtuigd tijdens de vergadering.,Argument Structure,ditransitive_nomdat_2,1813,overtuigd,heeft
De verrassing op haar verjaardag heeft haar enorm geplezierd.,De verrassing op haar verjaardag is haar enorm geplezierd.,Argument Structure,ditransitive_nomdat_2,1814,geplezierd,heeft
De aanmoediging van haar coach heeft haar zelfvertrouwen vergroot.,De aanmoediging van haar coach is haar zelfvertrouwen vergroot.,Argument Structure,ditransitive_nomdat_2,1815,vergroot,heeft
Haar complimenten hebben hem echt behaagd.,Haar complimenten zijn hem echt behaagd.,Argument Structure,ditransitive_nomdat_2,1816,behaagd,hebben
De commissie heeft een expert benoemd om het probleem te onderzoeken.,De commissie is een expert benoemd om het probleem te onderzoeken.,Argument Structure,ditransitive_nomdat_2,1817,benoemd,heeft
Hij heeft zijn liefde voor haar eindelijk beleden.,Hij is zijn liefde voor haar eindelijk beleden.,Argument Structure,ditransitive_nomdat_2,1818,beleden,heeft
Het slechte weer heeft ons belet om naar buiten te gaan.,Het slechte weer is ons belet om naar buiten te gaan.,Argument Structure,ditransitive_nomdat_2,1819,belet,heeft
Ik heb altijd mijn vrienden benijd om hun reislust.,Ik ben altijd mijn vrienden benijd om hun reislust.,Argument Structure,ditransitive_nomdat_2,1820,benijd,heb
We hebben de kans benut om nieuwe vaardigheden te leren.,We zijn de kans benut om nieuwe vaardigheden te leren.,Argument Structure,ditransitive_nomdat_2,1821,benut,hebben
De commissie heeft een expert benoemd om het probleem te onderzoeken.,De commissie is een expert benoemd om het probleem te onderzoeken.,Argument Structure,ditransitive_nomdat_2,1822,benoemd,heeft
De politie heeft de verdachte officieel beschuldigd van diefstal.,De politie is de verdachte officieel beschuldigd van diefstal.,Argument Structure,ditransitive_nomdat_2,1823,beschuldigd,heeft
Het slechte gedrag van de medewerker heeft het hele team beschaamd.,Het slechte gedrag van de medewerker is het hele team beschaamd.,Argument Structure,ditransitive_nomdat_2,1824,beschaamd,heeft
De bodyguard heeft de beroemdheid goed beschermd tegen de paparazzi.,De bodyguard is de beroemdheid goed beschermd tegen de paparazzi.,Argument Structure,ditransitive_nomdat_2,1825,beschermd,heeft
Het virus heeft snel meerdere mensen besmet.,Het virus is snel meerdere mensen besmet.,Argument Structure,ditransitive_nomdat_2,1826,besmet,heeft
De modder heeft mijn kleding bevlekt tijdens de wandeling.,De modder is mijn kleding bevlekt tijdens de wandeling.,Argument Structure,ditransitive_nomdat_2,1827,bevlekt,heeft
De magische show heeft het publiek betoverd.,De magische show is het publiek betoverd.,Argument Structure,ditransitive_nomdat_2,1828,betoverd,heeft
De kunstliefhebber heeft het schilderij lange tijd bewonderd.,De kunstliefhebber is het schilderij lange tijd bewonderd.,Argument Structure,ditransitive_nomdat_2,1829,bewonderd,heeft
De inspirerende toespraak heeft de menigte bezield.,De inspirerende toespraak is de menigte bezield.,Argument Structure,ditransitive_nomdat_2,1830,bezield,heeft
De docent heeft haar dit boek aanbevolen tijdens de les.,De docent is haar dit boek aanbevolen tijdens de les.,Argument Structure,ditransitive_nomdat_3,111,aanbevolen,heeft
De echtgenoot heeft haar een vakantie beloofd over twee weken.,De echtgenoot is haar een vakantie beloofd over twee weken.,Argument Structure,ditransitive_nomdat_3,112,beloofd,heeft
De baas heeft hem deze taken bevolen de komende week.,De baas is hem deze taken bevolen de komende week.,Argument Structure,ditransitive_nomdat_3,113,bevolen,heeft
De grootouders hebben hem veel geld nagelaten in hun testament.,De grootouders zijn hem veel geld nagelaten in hun testament.,Argument Structure,ditransitive_nomdat_3,114,nagelaten,hebben
De ouders hebben haar de poppen ontnomen voor een week.,De ouders zijn haar de poppen ontnomen voor een week.,Argument Structure,ditransitive_nomdat_3,115,ontnomen,hebben
De klasgenoten hebben haar een kaart toegestuurd vanuit hun vakantieadres.,De klasgenoten zijn haar een kaart toegestuurd vanuit hun vakantieadres.,Argument Structure,ditransitive_nomdat_3,116,toegestuurd,hebben
De verhuurder heeft hem het roken verboden in het huis.,De verhuurder is hem het roken verboden in het huis.,Argument Structure,ditransitive_nomdat_3,117,verboden,heeft
Het meisje heeft hem een spel gevraagd voor haar verjaardag.,Het meisje is hem een spel gevraagd voor haar verjaardag.,Argument Structure,ditransitive_nomdat_3,118,gevraagd,heeft
De mannen hebben haar het wachtwoord toegeroepen in de winkel.,De mannen zijn haar het wachtwoord toegeroepen in de winkel.,Argument Structure,ditransitive_nomdat_3,119,toegeroepen,hebben
De jongens hebben haar het geheim toevertrouwd in de pauze.,De jongens zijn haar het geheim toevertrouwd in de pauze.,Argument Structure,ditransitive_nomdat_3,120,toevertrouwd,hebben
De fouten hebben de ingenieur wat hoofdpijn bezorgd.,De fouten zijn de ingenieur wat hoofdpijn bezorgd.,Argument Structure,ditransitive_nomdat_3,1831,bezorgd,hebben
De ontmoeting heeft Eva een blijvende indruk gegeven.,De ontmoeting is Eva een blijvende indruk gegeven.,Argument Structure,ditransitive_nomdat_3,1832,gegeven,heeft
De reis heeft Sam nieuwe perspectieven gegeven.,De reis is Sam nieuwe perspectieven gegeven.,Argument Structure,ditransitive_nomdat_3,1833,gegeven,heeft
De oefeningen hebben de atleet in topvorm gebracht.,De oefeningen zijn de atleet in topvorm gebracht.,Argument Structure,ditransitive_nomdat_3,1834,gebracht,hebben
De veranderingen hebben het bedrijf efficiënter gemaakt.,De veranderingen zijn het bedrijf efficiënter gemaakt.,Argument Structure,ditransitive_nomdat_3,1835,gemaakt,hebben
De experimenten hebben de wetenschappers veel geleerd.,De experimenten zijn de wetenschappers veel geleerd.,Argument Structure,ditransitive_nomdat_3,1836,geleerd,hebben
De experimenten hebben de wetenschappers waardevolle informatie opgeleverd.,De experimenten zijn de wetenschappers waardevolle informatie opgeleverd.,Argument Structure,ditransitive_nomdat_3,1837,opgeleverd,hebben
Na een goede nachtrust heeft ze haar kracht weer bekomen.,Na een goede nachtrust is ze haar kracht weer bekomen.,Argument Structure,ditransitive_nomdat_3,1838,bekomen,heeft
De theatervoorstelling heeft het publiek een unieke ervaring bezorgd.,De theatervoorstelling is het publiek een unieke ervaring bezorgd.,Argument Structure,ditransitive_nomdat_3,1839,bezorgd,heeft
