sentence_good,sentence_bad,linguistic_phenomenon,good_cue,bad_cue,critical_region,item_id
Sen grup projesinin konusuna kendin kimseye danışmadan karar verdin.,Sen grup projesinin konusuna kendi kimseye danışmadan karar verdin.,anaphor_agreement,kendin,kendi,verdin,553
Bir baskıdan etkilenmemek için kendimize daha fazla güvenmeliyiz.,Bir baskıdan etkilenmemek için kendinize daha fazla güvenmeliyiz.,anaphor_agreement,kendimize,kendinize,güvenmeliyiz,554
Baskıdan etkilenmemek için kendimize daha fazla güvenmeliyiz.,Baskıdan etkilenmemek için kendinize daha fazla güvenmeliyiz.,anaphor_agreement,kendimize,kendinize,güvenmeliyiz,555
Bu bütün çabalara rağmen sonuç değişmeyince kendimizi çaresiz hissettik.,Bu bütün çabalara rağmen sonuç değişmeyince kendinizi çaresiz hissettik.,anaphor_agreement,kendimizi,kendinizi,hissettik,556
Öncelikle arabayı kendim servisi aramadan tamir ettim.,Öncelikle arabayı kendi servisi aramadan tamir ettim.,anaphor_agreement,kendim,kendi,ettim,557
Ben bu konuda yanlış yönlendirildiysen kendimi sorumlu tutarım.,Ben bu konuda yanlış yönlendirildiysen kendini sorumlu tutarım.,anaphor_agreement,kendimi,kendini,tutarım,558
Ben bu kitabı kendim hiç kimseden yardım almadan yazdım.,Ben bu kitabı kendi hiç kimseden yardım almadan yazdım.,anaphor_agreement,kendim,kendi,yazdım,559
Ayrıca ders notlarımı kendim başkasından not almadan çıkardım.,Ayrıca ders notlarımı kendi başkasından not almadan çıkardım.,anaphor_agreement,kendim,kendi,çıkardım,560
Ayrıca bu sınavı kendim herhangi bir eğitim almadan geçtim.,Ayrıca bu sınavı kendi herhangi bir eğitim almadan geçtim.,anaphor_agreement,kendim,kendi,geçtim,561
O beklenmedik tepki alınca kendini savunmaya geçti.,O beklenmedik tepki alınca kendimi savunmaya geçti.,anaphor_agreement,kendini,kendimi,geçti,562
Bir beklenmedik tepki alınca kendini savunmaya geçti.,Bir beklenmedik tepki alınca kendimi savunmaya geçti.,anaphor_agreement,kendini,kendimi,geçti,563
İlk eğitimini kendi maddi destek almadan tamamladı.,İlk eğitimini kendin maddi destek almadan tamamladı.,anaphor_agreement,kendi,kendin,tamamladı,564
Çok yanlış anlaşılınca kendimi açıklamak zorunda kaldım.,Çok yanlış anlaşılınca kendini açıklamak zorunda kaldım.,anaphor_agreement,kendimi,kendini,kaldım,565
O atkıyı mağazadan almak yerine kendi evde ördü.,O atkıyı mağazadan almak yerine kendim evde ördü.,anaphor_agreement,kendi,kendim,ördü,566
Yine uzun bir aradan sonra gitarı eline alınca kendini acemi hissetti.,Yine uzun bir aradan sonra gitarı eline alınca kendimi acemi hissetti.,anaphor_agreement,kendini,kendimi,hissetti,567
İlk ders notlarımı kendim başkasından not almadan çıkardım.,İlk ders notlarımı kendi başkasından not almadan çıkardım.,anaphor_agreement,kendim,kendi,çıkardım,568
Öncelikle gün içinde stres seviyesini azaltmak için kendime olumlu şeyler telkin ediyorum.,Öncelikle gün içinde stres seviyesini azaltmak için kendine olumlu şeyler telkin ediyorum.,anaphor_agreement,kendime,kendine,ediyorum,569
Biz i̇leriye hazırlık için işleri kendim görüyorum.,Biz i̇leriye hazırlık için işleri kendin görüyorum.,anaphor_agreement,kendim,kendin,görüyorum,570
Birlikte gelen mobilyaları kendiniz kılavuza bakarak kurabilirsiniz.,Birlikte gelen mobilyaları kendimiz kılavuza bakarak kurabilirsiniz.,anaphor_agreement,kendiniz,kendimiz,kurabilirsiniz,571
Ben bu şarkıyı kendim profesyonel bir yapımcıyla çalışmadan besteledim.,Ben bu şarkıyı kendi profesyonel bir yapımcıyla çalışmadan besteledim.,anaphor_agreement,kendim,kendi,besteledim,572
Altın ödülünü alırken kendimi gerçekten gururlu hissettim.,Altın ödülünü alırken kendini gerçekten gururlu hissettim.,anaphor_agreement,kendimi,kendini,hissettim,573
Sadece mutfak dolaplarını kendim usta çağırmadan monte ettim.,Sadece mutfak dolaplarını kendi usta çağırmadan monte ettim.,anaphor_agreement,kendim,kendi,ettim,574
Bu sabah ilaç içmeyi unutmaman için kendime bir not yazdım.,Bu sabah ilaç içmeyi unutmaman için kendine bir not yazdım.,anaphor_agreement,kendime,kendine,yazdım,575
Biz uzun ve sağlıklı bir yaşam için kendimize daha iyi bakmaya karar verdik.,Biz uzun ve sağlıklı bir yaşam için kendinize daha iyi bakmaya karar verdik.,anaphor_agreement,kendimize,kendinize,verdik,576
Ama bu tabloyu kendim resim dersi almadan yaptım.,Ama bu tabloyu kendi resim dersi almadan yaptım.,anaphor_agreement,kendim,kendi,yaptım,577
Bu malum olaydan beri kendimi ona karşı mahcup hissediyorum.,Bu malum olaydan beri kendini ona karşı mahcup hissediyorum.,anaphor_agreement,kendimi,kendini,hissediyorum,578
Adam yeni bir ortama girerken kendini ilk etapta çekingen hisseder.,Adam yeni bir ortama girerken kendimi ilk etapta çekingen hisseder.,anaphor_agreement,kendini,kendimi,hisseder,579
Bu ne olursa olsun ben yeterliyim diye düşünüp kendini her koşulda beğenir.,Bu ne olursa olsun ben yeterliyim diye düşünüp kendimi her koşulda beğenir.,anaphor_agreement,kendini,kendimi,beğenir,580
Bu ders notlarımı kendim başkasından not almadan çıkardım.,Bu ders notlarımı kendi başkasından not almadan çıkardım.,anaphor_agreement,kendim,kendi,çıkardım,581
Üniversite okuduğum bölümü kendim kimseden rehberlik almadan yazdım.,Üniversite okuduğum bölümü kendi kimseden rehberlik almadan yazdım.,anaphor_agreement,kendim,kendi,yazdım,582
Adam bu kadar baskı altında kendini bir türlü toparlayamadı.,Adam bu kadar baskı altında kendimi bir türlü toparlayamadı.,anaphor_agreement,kendini,kendimi,toparlayamadı,583
Öncelikle kendi sınırlarını zorlamayı seven biri olarak kendimi hep daha iyisini yapmaya koşullarım.,Öncelikle kendi sınırlarını zorlamayı seven biri olarak kendini hep daha iyisini yapmaya koşullarım.,anaphor_agreement,kendimi,kendini,koşullarım,584
Eğer başkalarına yardım edebilmek için kendine öncelik vermelisin.,Eğer başkalarına yardım edebilmek için kendime öncelik vermelisin.,anaphor_agreement,kendine,kendime,vermelisin,585
Genç kardeşin ödevini kendi kimseden yardım almadan yaptı.,Genç kardeşin ödevini kendin kimseden yardım almadan yaptı.,anaphor_agreement,kendi,kendin,yaptı,586
Özellikle grup projesinin konusuna kendin kimseye danışmadan karar verdin.,Özellikle grup projesinin konusuna kendi kimseye danışmadan karar verdin.,anaphor_agreement,kendin,kendi,verdin,587
Genç öğrenciler konferansın web sitesini kendileri hazırlamış.,Genç öğrenciler konferansın web sitesini kendiniz hazırlamış.,anaphor_agreement,kendileri,kendiniz,hazırlamış,588
Böyle övgüleri duyunca kendimizi bir kez daha tebrik ettik.,Böyle övgüleri duyunca kendinizi bir kez daha tebrik ettik.,anaphor_agreement,kendimizi,kendinizi,ettik,589
Ve maratona hazırlanmak için kendime daha fazla zaman tanıdım.,Ve maratona hazırlanmak için kendine daha fazla zaman tanıdım.,anaphor_agreement,kendime,kendine,tanıdım,590
Evet fransızcayı kendim herhangi bir kursa gitmeden öğrendim.,Evet fransızcayı kendi herhangi bir kursa gitmeden öğrendim.,anaphor_agreement,kendim,kendi,öğrendim,591
Biz bu kadar çaba harcadıktan sonra kendimizi söylediğiniz gibi ödüllendirdik.,Biz bu kadar çaba harcadıktan sonra kendinizi söylediğiniz gibi ödüllendirdik.,anaphor_agreement,kendimizi,kendinizi,ödüllendirdik,592
Yani her şeye böyle evet dedikçe kendinizi hiç olmayacak işlerin içinde bulursunuz.,Yani her şeye böyle evet dedikçe kendimizi hiç olmayacak işlerin içinde bulursunuz.,anaphor_agreement,kendinizi,kendimizi,bulursunuz,593
Bir grup projesinin konusuna kendin kimseye danışmadan karar verdin.,Bir grup projesinin konusuna kendi kimseye danışmadan karar verdin.,anaphor_agreement,kendin,kendi,verdin,594
Benim okuduğum bölümü kendim kimseden rehberlik almadan yazdım.,Benim okuduğum bölümü kendi kimseden rehberlik almadan yazdım.,anaphor_agreement,kendim,kendi,yazdım,595
Ancak tartışmanın ardından kendilerini haklı çıkarmaya çalıştılar.,Ancak tartışmanın ardından kendimizi haklı çıkarmaya çalıştılar.,anaphor_agreement,kendilerini,kendimizi,çalıştılar,596
Yani yeni bir iş ortamında kendimizi bir an önce kanıtlamaya çalıştık.,Yani yeni bir iş ortamında kendilerini bir an önce kanıtlamaya çalıştık.,anaphor_agreement,kendimizi,kendilerini,çalıştık,597
Mezuniyet fotoğraflarını kendimiz okul meydanında çektik.,Mezuniyet fotoğraflarını kendiniz okul meydanında çektik.,anaphor_agreement,kendimiz,kendiniz,çektik,598
Yine geçen günkü konuşmamızdan sonra kendinizi yok yere gaza getirmişsiniz.,Yine geçen günkü konuşmamızdan sonra kendimizi yok yere gaza getirmişsiniz.,anaphor_agreement,kendinizi,kendimizi,getirmişsiniz,599
Bütün festival programını kendimiz dışarıdan bir yönlendirme olmadan belirledik.,Bütün festival programını kendiniz dışarıdan bir yönlendirme olmadan belirledik.,anaphor_agreement,kendimiz,kendiniz,belirledik,600
Ayrıca mutfak dolaplarını kendim usta çağırmadan monte ettim.,Ayrıca mutfak dolaplarını kendi usta çağırmadan monte ettim.,anaphor_agreement,kendim,kendi,ettim,601
Bu i̇spanyolcayı kendim internette pratik yaparak öğrendim.,Bu i̇spanyolcayı kendi internette pratik yaparak öğrendim.,anaphor_agreement,kendim,kendi,öğrendim,602
Çünkü herkes sırt çevirmişken bile kendine güvenmeye devam etti.,Çünkü herkes sırt çevirmişken bile kendime güvenmeye devam etti.,anaphor_agreement,kendine,kendime,etti,603
Ev taşınırken evin duvarlarını kendim usta çağırmadan boyadım.,Ev taşınırken evin duvarlarını kendi usta çağırmadan boyadım.,anaphor_agreement,kendim,kendi,boyadım,604
Kendilerine vereceğimiz ödülü öğrenince kendilerini öne attılar.,Kendilerine vereceğimiz ödülü öğrenince kendimizi öne attılar.,anaphor_agreement,kendilerini,kendimizi,attılar,605
İki tartışmanın ardından kendilerini haklı çıkarmaya çalıştılar.,İki tartışmanın ardından kendimizi haklı çıkarmaya çalıştılar.,anaphor_agreement,kendilerini,kendimizi,çalıştılar,606
Kız canını acıttığını fark edince kendini geri çekti.,Kız canını acıttığını fark edince kendimi geri çekti.,anaphor_agreement,kendini,kendimi,çekti,607
Ben haksız olduğunu kabul etmek istemediği için kendini canhıraş savundu.,Ben haksız olduğunu kabul etmek istemediği için kendimi canhıraş savundu.,anaphor_agreement,kendini,kendimi,savundu,608
İlk kitabımı kendim her türlü maddi sıkıntıyı göze alarak bastırdım.,İlk kitabımı kendi her türlü maddi sıkıntıyı göze alarak bastırdım.,anaphor_agreement,kendim,kendi,bastırdım,609
Bunlar böyle devam ederse yakında kendimizi çok daha iyi yerlerde göreceğiz.,Bunlar böyle devam ederse yakında kendinizi çok daha iyi yerlerde göreceğiz.,anaphor_agreement,kendimizi,kendinizi,göreceğiz,610
Daha önce başardıklarımı hatırlayıp kendimi motive ettim.,Daha önce başardıklarımı hatırlayıp kendini motive ettim.,anaphor_agreement,kendimi,kendini,ettim,611
Sevgili annem mağazadan almak yerine kendi evde dikti.,Sevgili annem mağazadan almak yerine kendim evde dikti.,anaphor_agreement,kendi,kendim,dikti,612
Kapanış konuşmasını kendileri moderatörden izin almadan yapmışlar.,Kapanış konuşmasını kendimiz moderatörden izin almadan yapmışlar.,anaphor_agreement,kendileri,kendimiz,yapmışlar,613
Öncelikle fransızcayı kendim herhangi bir kursa gitmeden öğrendim.,Öncelikle fransızcayı kendi herhangi bir kursa gitmeden öğrendim.,anaphor_agreement,kendim,kendi,öğrendim,614
Aslında i̇lk adımı kendim aslında karşıdan hiçbir beklentim olmadan attım.,Aslında i̇lk adımı kendi aslında karşıdan hiçbir beklentim olmadan attım.,anaphor_agreement,kendim,kendi,attım,615
Hep yanlışlıkla kendimi aradım.,Hep yanlışlıkla kendini aradım.,anaphor_agreement,kendimi,kendini,aradım,616
Gezi rotasını kendimiz internete bakmadan oluşturduk.,Gezi rotasını kendiniz internete bakmadan oluşturduk.,anaphor_agreement,kendimiz,kendiniz,oluşturduk,617
Onun saçlarını evde kendim kutu boyayla boyadım.,Onun saçlarını evde kendi kutu boyayla boyadım.,anaphor_agreement,kendim,kendi,boyadım,618
Hayat ne olursa olsun ben yeterliyim diye düşünüp kendini her koşulda beğenir.,Hayat ne olursa olsun ben yeterliyim diye düşünüp kendimi her koşulda beğenir.,anaphor_agreement,kendini,kendimi,beğenir,619
Benim fransızcayı kendim herhangi bir kursa gitmeden öğrendim.,Benim fransızcayı kendi herhangi bir kursa gitmeden öğrendim.,anaphor_agreement,kendim,kendi,öğrendim,620
Ben bu sınavı kendim herhangi bir eğitim almadan geçtim.,Ben bu sınavı kendi herhangi bir eğitim almadan geçtim.,anaphor_agreement,kendim,kendi,geçtim,621
Öğrenciler tartışmanın ardından kendilerini haklı çıkarmaya çalıştılar.,Öğrenciler tartışmanın ardından kendimizi haklı çıkarmaya çalıştılar.,anaphor_agreement,kendilerini,kendimizi,çalıştılar,622
Fakat kapanış konuşmasını kendileri moderatörden izin almadan yapmışlar.,Fakat kapanış konuşmasını kendimiz moderatörden izin almadan yapmışlar.,anaphor_agreement,kendileri,kendimiz,yapmışlar,623
Bir sınavdan düşük not alınca kendini çok başarısız hissetti.,Bir sınavdan düşük not alınca kendimi çok başarısız hissetti.,anaphor_agreement,kendini,kendimi,hissetti,624
Bir sahnede kendini çok gergin hissediyordu.,Bir sahnede kendimi çok gergin hissediyordu.,anaphor_agreement,kendini,kendimi,hissediyordu,625
Özellikle kapanış konuşmasını kendileri moderatörden izin almadan yapmışlar.,Özellikle kapanış konuşmasını kendimiz moderatörden izin almadan yapmışlar.,anaphor_agreement,kendileri,kendimiz,yapmışlar,626
Zor zamanlardan geçtiği için bu aralar kendine iyi davranıyor.,Zor zamanlardan geçtiği için bu aralar kendine iyi davranıyor.,anaphor_agreement,kendine,kendine,davranıyor,627
Kişi yeni bir ortama girerken kendini ilk etapta çekingen hisseder.,Kişi yeni bir ortama girerken kendimi ilk etapta çekingen hisseder.,anaphor_agreement,kendini,kendimi,hisseder,628
Talimatı kendileri kimseden izin almadan vermişler.,Talimatı kendimiz kimseden izin almadan vermişler.,anaphor_agreement,kendileri,kendimiz,vermişler,629
Ben herkesin gözü önündeyken kendimi rahat hissedemem.,Ben herkesin gözü önündeyken kendini rahat hissedemem.,anaphor_agreement,kendimi,kendini,hissedemem,630
Ben yaşadığımız sorunu kendim kimseyi incitmeden izah ettim.,Ben yaşadığımız sorunu kendin kimseyi incitmeden izah ettim.,anaphor_agreement,kendim,kendin,ettim,631
Jandarma amirimiz nöbet listesini kendi kimseye sormadan hazırlıyor.,Jandarma amirimiz nöbet listesini kendim kimseye sormadan hazırlıyor.,anaphor_agreement,kendi,kendim,hazırlıyor,632
Beni bu konuda yanlış yönlendirildiysen kendimi sorumlu tutarım.,Beni bu konuda yanlış yönlendirildiysen kendini sorumlu tutarım.,anaphor_agreement,kendimi,kendini,tutarım,633
Biz bütün çabalara rağmen sonuç değişmeyince kendimizi çaresiz hissettik.,Biz bütün çabalara rağmen sonuç değişmeyince kendinizi çaresiz hissettik.,anaphor_agreement,kendimizi,kendinizi,hissettik,634
İlk ehliyet sınavını kendim kursa gitmeden geçtim.,İlk ehliyet sınavını kendi kursa gitmeden geçtim.,anaphor_agreement,kendim,kendi,geçtim,635
Şirket şirketi kendi hiçbir yatırımcı olmadan kurdu.,Şirket şirketi kendin hiçbir yatırımcı olmadan kurdu.,anaphor_agreement,kendi,kendin,kurdu,636
Çok zor zamanlardan geçtiği için bu aralar kendine iyi davranıyor.,Çok zor zamanlardan geçtiği için bu aralar kendine iyi davranıyor.,anaphor_agreement,kendine,kendine,davranıyor,637
Bu çalışma programımı kendim hocaya sormadan hazırladım.,Bu çalışma programımı kendi hocaya sormadan hazırladım.,anaphor_agreement,kendim,kendi,hazırladım,638
Öğrenciler sunum yapmadan önce kendilerini çok gergin hissediyorlardı.,Öğrenciler sunum yapmadan önce kendimizi çok gergin hissediyorlardı.,anaphor_agreement,kendilerini,kendimizi,hissediyorlardı,639
Diğer performans kayıtlarını izleyerek kendimi geliştirmeye çalışıyorum.,Diğer performans kayıtlarını izleyerek kendini geliştirmeye çalışıyorum.,anaphor_agreement,kendimi,kendini,çalışıyorum,640
Fatih okula kendi otobüsle gidiyor.,Fatih okula kendim otobüsle gidiyor.,anaphor_agreement,kendi,kendim,gidiyor,641
Ama kendi sınırlarını zorlamayı seven biri olarak kendimi hep daha iyisini yapmaya koşullarım.,Ama kendi sınırlarını zorlamayı seven biri olarak kendini hep daha iyisini yapmaya koşullarım.,anaphor_agreement,kendimi,kendini,koşullarım,642
Bu fransızcayı kendim herhangi bir kursa gitmeden öğrendim.,Bu fransızcayı kendi herhangi bir kursa gitmeden öğrendim.,anaphor_agreement,kendim,kendi,öğrendim,643
Festival programını kendimiz dışarıdan bir yönlendirme olmadan belirledik.,Festival programını kendiniz dışarıdan bir yönlendirme olmadan belirledik.,anaphor_agreement,kendimiz,kendiniz,belirledik,644
Çünkü bu mesajı kendim kesinlikle hiçbir psikolojik baskı altında kalmadan yazdım.,Çünkü bu mesajı kendi kesinlikle hiçbir psikolojik baskı altında kalmadan yazdım.,anaphor_agreement,kendim,kendi,yazdım,645
Hatta oyunu geliştirmeye kendi daha hiç yatırımcı yokken başladı.,Hatta oyunu geliştirmeye kendin daha hiç yatırımcı yokken başladı.,anaphor_agreement,kendi,kendin,başladı,646
Üstelik bu sınavı kendim herhangi bir eğitim almadan geçtim.,Üstelik bu sınavı kendi herhangi bir eğitim almadan geçtim.,anaphor_agreement,kendim,kendi,geçtim,647
Ve hedeflerin gerçekleşmesi için kendime önemli sözler verdim.,Ve hedeflerin gerçekleşmesi için kendine önemli sözler verdim.,anaphor_agreement,kendime,kendine,verdim,648
Ayrıca bu tabloyu kendim resim dersi almadan yaptım.,Ayrıca bu tabloyu kendi resim dersi almadan yaptım.,anaphor_agreement,kendim,kendi,yaptım,649
Kadın yeni bir ortama girerken kendini ilk etapta çekingen hisseder.,Kadın yeni bir ortama girerken kendimi ilk etapta çekingen hisseder.,anaphor_agreement,kendini,kendimi,hisseder,650
Çünkü yoğun antrenman temposu yüzünden eve gelince kendimi çok yorgun hissediyorum.,Çünkü yoğun antrenman temposu yüzünden eve gelince kendini çok yorgun hissediyorum.,anaphor_agreement,kendimi,kendini,hissediyorum,651
Tatil planını kendimiz tur şirketine bağlı kalmadan yaptık.,Tatil planını kendiniz tur şirketine bağlı kalmadan yaptık.,anaphor_agreement,kendimiz,kendiniz,yaptık,652
Hayat zor zamanlardan geçtiği için bu aralar kendine iyi davranıyor.,Hayat zor zamanlardan geçtiği için bu aralar kendine iyi davranıyor.,anaphor_agreement,kendine,kendine,davranıyor,653
Yazar kapanış konuşmasını kendileri moderatörden izin almadan yapmışlar.,Yazar kapanış konuşmasını kendimiz moderatörden izin almadan yapmışlar.,anaphor_agreement,kendileri,kendimiz,yapmışlar,654
Burada yaşadığımız sorunu kendim kimseyi incitmeden izah ettim.,Burada yaşadığımız sorunu kendin kimseyi incitmeden izah ettim.,anaphor_agreement,kendim,kendin,ettim,655
Eğer bu konuda yanlış yönlendirildiysen kendimi sorumlu tutarım.,Eğer bu konuda yanlış yönlendirildiysen kendini sorumlu tutarım.,anaphor_agreement,kendimi,kendini,tutarım,656
Triatlona katılmak için kendimizi çok motive ettik.,Triatlona katılmak için kendinizi çok motive ettik.,anaphor_agreement,kendimizi,kendinizi,ettik,657
Performans kayıtlarını izleyerek kendimi geliştirmeye çalışıyorum.,Performans kayıtlarını izleyerek kendini geliştirmeye çalışıyorum.,anaphor_agreement,kendimi,kendini,çalışıyorum,658
Haksız olduğunu kabul etmek istemediği için kendini canhıraş savundu.,Haksız olduğunu kabul etmek istemediği için kendimi canhıraş savundu.,anaphor_agreement,kendini,kendimi,savundu,659
Son kararı kendi hiç kimseden fikir almadan verdi.,Son kararı kendim hiç kimseden fikir almadan verdi.,anaphor_agreement,kendi,kendim,verdi,660
Ben bu kitabı kendim hiç kimseden yardım almadan yazdım.,Ben bu kitabı kendi hiç kimseden yardım almadan yazdım.,anaphor_agreement,kendim,kendi,yazdım,661
Birçok yanlış anlaşılmayı kendim herkesle tek tek konuşarak çözdüm.,Birçok yanlış anlaşılmayı kendin herkesle tek tek konuşarak çözdüm.,anaphor_agreement,kendim,kendin,çözdüm,662
Yanında gelen mobilyaları kendiniz kılavuza bakarak kurabilirsiniz.,Yanında gelen mobilyaları kendimiz kılavuza bakarak kurabilirsiniz.,anaphor_agreement,kendiniz,kendimiz,kurabilirsiniz,663
Burada yanlış anlaşılınca kendimi açıklamak zorunda kaldım.,Burada yanlış anlaşılınca kendini açıklamak zorunda kaldım.,anaphor_agreement,kendimi,kendini,kaldım,664
Projeye kendin bizim fikrimizi hiç almadan karar verdin.,Projeye kendimiz bizim fikrimizi hiç almadan karar verdin.,anaphor_agreement,kendin,kendimiz,verdin,665
Deniz yoğun geçen bir günün ardından kendini şımartmak istedi.,Deniz yoğun geçen bir günün ardından kendimi şımartmak istedi.,anaphor_agreement,kendini,kendimi,istedi,666
Daha geçen günkü konuşmamızdan sonra kendinizi yok yere gaza getirmişsiniz.,Daha geçen günkü konuşmamızdan sonra kendimizi yok yere gaza getirmişsiniz.,anaphor_agreement,kendinizi,kendimizi,getirmişsiniz,667
Sonra yanlış anlaşılınca kendimi açıklamak zorunda kaldım.,Sonra yanlış anlaşılınca kendini açıklamak zorunda kaldım.,anaphor_agreement,kendimi,kendini,kaldım,668
Ama daha önce başardıklarımı hatırlayıp kendimi motive ettim.,Ama daha önce başardıklarımı hatırlayıp kendini motive ettim.,anaphor_agreement,kendimi,kendini,ettim,669
Çok uzun bir aradan sonra gitarı eline alınca kendini acemi hissetti.,Çok uzun bir aradan sonra gitarı eline alınca kendimi acemi hissetti.,anaphor_agreement,kendini,kendimi,hissetti,670
Kız okula kendi otobüsle gidiyor.,Kız okula kendim otobüsle gidiyor.,anaphor_agreement,kendi,kendim,gidiyor,671
Bu yanlış anlaşılmayı kendim herkesle tek tek konuşarak çözdüm.,Bu yanlış anlaşılmayı kendin herkesle tek tek konuşarak çözdüm.,anaphor_agreement,kendim,kendin,çözdüm,672
Özellikle yoğun antrenman temposu yüzünden eve gelince kendimi çok yorgun hissediyorum.,Özellikle yoğun antrenman temposu yüzünden eve gelince kendini çok yorgun hissediyorum.,anaphor_agreement,kendimi,kendini,hissediyorum,673
Öncelikle başkalarına yardım edebilmek için kendine öncelik vermelisin.,Öncelikle başkalarına yardım edebilmek için kendime öncelik vermelisin.,anaphor_agreement,kendine,kendime,vermelisin,674
Gün içinde stres seviyesini azaltmak için kendime olumlu şeyler telkin ediyorum.,Gün içinde stres seviyesini azaltmak için kendine olumlu şeyler telkin ediyorum.,anaphor_agreement,kendime,kendine,ediyorum,675
Sadece herkesin gözü önündeyken kendimi rahat hissedemem.,Sadece herkesin gözü önündeyken kendini rahat hissedemem.,anaphor_agreement,kendimi,kendini,hissedemem,676
Onun canını acıttığını fark edince kendini geri çekti.,Onun canını acıttığını fark edince kendimi geri çekti.,anaphor_agreement,kendini,kendimi,çekti,677
Yabancı öğrenciler konferansın web sitesini kendileri hazırlamış.,Yabancı öğrenciler konferansın web sitesini kendiniz hazırlamış.,anaphor_agreement,kendileri,kendiniz,hazırlamış,678
Güzel övgüleri duyunca kendimizi bir kez daha tebrik ettik.,Güzel övgüleri duyunca kendinizi bir kez daha tebrik ettik.,anaphor_agreement,kendimizi,kendinizi,ettik,679
Dış baskıdan etkilenmemek için kendimize daha fazla güvenmeliyiz.,Dış baskıdan etkilenmemek için kendinize daha fazla güvenmeliyiz.,anaphor_agreement,kendimize,kendinize,güvenmeliyiz,680
Adam bu sefer kimseyi kırmamak için kendini daha dikkatli ifade etti.,Adam bu sefer kimseyi kırmamak için kendimi daha dikkatli ifade etti.,anaphor_agreement,kendini,kendimi,etti,681
Birçok sunum yapmadan önce kendilerini çok gergin hissediyorlardı.,Birçok sunum yapmadan önce kendimizi çok gergin hissediyorlardı.,anaphor_agreement,kendilerini,kendimizi,hissediyorlardı,682
Bu arabayı kendim servisi aramadan tamir ettim.,Bu arabayı kendi servisi aramadan tamir ettim.,anaphor_agreement,kendim,kendi,ettim,683
Ama bütün çabalara rağmen sonuç değişmeyince kendimizi çaresiz hissettik.,Ama bütün çabalara rağmen sonuç değişmeyince kendinizi çaresiz hissettik.,anaphor_agreement,kendimizi,kendinizi,hissettik,684
Üniversite mezuniyet balosunu kendimiz sponsor almadan organize ettik.,Üniversite mezuniyet balosunu kendiniz sponsor almadan organize ettik.,anaphor_agreement,kendimiz,kendiniz,ettik,685
O i̇lk adımı kendim aslında karşıdan hiçbir beklentim olmadan attım.,O i̇lk adımı kendi aslında karşıdan hiçbir beklentim olmadan attım.,anaphor_agreement,kendim,kendi,attım,686
Ve talimatı kendileri kimseden izin almadan vermişler.,Ve talimatı kendimiz kimseden izin almadan vermişler.,anaphor_agreement,kendileri,kendimiz,vermişler,687
Gazete kapanış konuşmasını kendileri moderatörden izin almadan yapmışlar.,Gazete kapanış konuşmasını kendimiz moderatörden izin almadan yapmışlar.,anaphor_agreement,kendileri,kendimiz,yapmışlar,688
Onun doğum günü partisini kendimiz bir organizasyon şirketi olmadan planladık.,Onun doğum günü partisini kendiniz bir organizasyon şirketi olmadan planladık.,anaphor_agreement,kendimiz,kendiniz,planladık,689
